17:31:19.798176 ARP, Request who-has 1.1.2.2 tell 1.1.2.3, length 28
17:31:19.809466 ARP, Reply 1.1.2.2 is-at 00:04:23:c7:a4:be, length 46
17:31:19.809480 IP 1.1.2.3.57966 > 5.6.7.8.80: Flags [S], seq 2318371066, win 5840, options [mss 1460,sackOK,TS val 837531 ecr 0,nop,wscale 6], length 0
17:31:19.821993 IP 5.6.7.8.80 > 1.1.2.3.57966: Flags [S.], seq 1816469641, ack 2318371067, win 5792, options [mss 1460,sackOK,TS val 794221 ecr 837531,nop,wscale 6], length 0
17:31:19.822041 IP 1.1.2.3.57966 > 5.6.7.8.80: Flags [.], ack 1816469642, win 92, options [nop,nop,TS val 837538 ecr 794221], length 0
17:31:19.822109 IP 1.1.2.3.57966 > 5.6.7.8.80: Flags [P.], seq 2318371067:2318371183, ack 1816469642, win 92, options [nop,nop,TS val 837538 ecr 794221], length 116
17:31:19.833575 IP 5.6.7.8.80 > 1.1.2.3.57966: Flags [.], ack 2318371183, win 91, options [nop,nop,TS val 794224 ecr 837538], length 0
17:31:20.030122 IP 1.1.2.3.57967 > 5.6.7.8.80: Flags [S], seq 1683374906, win 5840, options [mss 1460,sackOK,TS val 837590 ecr 0,nop,wscale 6], length 0
17:31:20.042533 IP 5.6.7.8.80 > 1.1.2.3.57967: Flags [S.], seq 3031024030, ack 1683374907, win 5792, options [mss 1460,sackOK,TS val 794276 ecr 837590,nop,wscale 6], length 0
17:31:20.042569 IP 1.1.2.3.57967 > 5.6.7.8.80: Flags [.], ack 3031024031, win 92, options [nop,nop,TS val 837593 ecr 794276], length 0
17:31:20.042637 IP 1.1.2.3.57967 > 5.6.7.8.80: Flags [P.], seq 1683374907:1683375023, ack 3031024031, win 92, options [nop,nop,TS val 837593 ecr 794276], length 116
17:31:20.054213 IP 5.6.7.8.80 > 1.1.2.3.57967: Flags [.], ack 1683375023, win 91, options [nop,nop,TS val 794279 ecr 837593], length 0
17:31:20.207561 IP 5.6.7.8.80 > 1.1.2.3.57967: Flags [.], seq 3031024031:3031025479, ack 1683375023, win 91, options [nop,nop,TS val 794317 ecr 837593], length 1448
17:31:20.207573 IP 1.1.2.3.57967 > 5.6.7.8.80: Flags [.], ack 3031025479, win 137, options [nop,nop,TS val 837635 ecr 794317], length 0
17:31:20.207582 IP 5.6.7.8.80 > 1.1.2.3.57967: Flags [.], seq 3031025479:3031026927, ack 1683375023, win 91, options [nop,nop,TS val 794317 ecr 837593], length 1448
17:31:20.207588 IP 1.1.2.3.57967 > 5.6.7.8.80: Flags [.], ack 3031026927, win 182, options [nop,nop,TS val 837635 ecr 794317], length 0
17:31:20.207593 IP 5.6.7.8.80 > 1.1.2.3.57967: Flags [.], seq 3031026927:3031028375, ack 1683375023, win 91, options [nop,nop,TS val 794317 ecr 837593], length 1448
17:31:20.207602 IP 1.1.2.3.57967 > 5.6.7.8.80: Flags [.], ack 3031028375, win 227, options [nop,nop,TS val 837635 ecr 794317], length 0
17:31:20.219293 IP 5.6.7.8.80 > 1.1.2.3.57967: Flags [.], seq 3031028375:3031029823, ack 1683375023, win 91, options [nop,nop,TS val 794320 ecr 837635], length 1448
17:31:20.219308 IP 1.1.2.3.57967 > 5.6.7.8.80: Flags [.], ack 3031029823, win 273, options [nop,nop,TS val 837638 ecr 794320], length 0
17:31:20.219314 IP 5.6.7.8.80 > 1.1.2.3.57967: Flags [P.], seq 3031029823:3031031271, ack 1683375023, win 91, options [nop,nop,TS val 794320 ecr 837635], length 1448
17:31:20.219321 IP 1.1.2.3.57967 > 5.6.7.8.80: Flags [.], ack 3031031271, win 318, options [nop,nop,TS val 837638 ecr 794320], length 0
17:31:20.219342 IP 5.6.7.8.80 > 1.1.2.3.57967: Flags [.], seq 3031031271:3031032719, ack 1683375023, win 91, options [nop,nop,TS val 794320 ecr 837635], length 1448
17:31:20.219349 IP 1.1.2.3.57967 > 5.6.7.8.80: Flags [.], ack 3031032719, win 363, options [nop,nop,TS val 837638 ecr 794320], length 0
17:31:20.219354 IP 5.6.7.8.80 > 1.1.2.3.57967: Flags [P.], seq 3031032719:3031033679, ack 1683375023, win 91, options [nop,nop,TS val 794320 ecr 837635], length 960
17:31:20.219360 IP 1.1.2.3.57967 > 5.6.7.8.80: Flags [.], ack 3031033679, win 408, options [nop,nop,TS val 837638 ecr 794320], length 0
17:31:20.219846 IP 1.1.2.3.57967 > 5.6.7.8.80: Flags [F.], seq 1683375023, ack 3031033679, win 408, options [nop,nop,TS val 837638 ecr 794320], length 0
17:31:20.231372 IP 5.6.7.8.80 > 1.1.2.3.57967: Flags [F.], seq 3031033679, ack 1683375024, win 91, options [nop,nop,TS val 794323 ecr 837638], length 0
17:31:20.231399 IP 1.1.2.3.57967 > 5.6.7.8.80: Flags [.], ack 3031033680, win 408, options [nop,nop,TS val 837641 ecr 794323], length 0
17:31:20.295345 IP 1.1.2.3.57968 > 5.6.7.8.80: Flags [S], seq 857863494, win 5840, options [mss 1460,sackOK,TS val 837657 ecr 0,nop,wscale 6], length 0
17:31:20.307099 IP 5.6.7.8.80 > 1.1.2.3.57968: Flags [S.], seq 4256174721, ack 857863495, win 5792, options [mss 1460,sackOK,TS val 794342 ecr 837657,nop,wscale 6], length 0
17:31:20.307133 IP 1.1.2.3.57968 > 5.6.7.8.80: Flags [.], ack 4256174722, win 92, options [nop,nop,TS val 837660 ecr 794342], length 0
17:31:20.307191 IP 1.1.2.3.57968 > 5.6.7.8.80: Flags [P.], seq 857863495:857863611, ack 4256174722, win 92, options [nop,nop,TS val 837660 ecr 794342], length 116
17:31:20.318601 IP 5.6.7.8.80 > 1.1.2.3.57968: Flags [.], ack 857863611, win 91, options [nop,nop,TS val 794345 ecr 837660], length 0
17:31:20.320858 IP 1.1.2.3.57969 > 5.6.7.8.80: Flags [S], seq 2193250770, win 5840, options [mss 1460,sackOK,TS val 837663 ecr 0,nop,wscale 6], length 0
17:31:20.321824 IP 5.6.7.8.80 > 1.1.2.3.57968: Flags [.], seq 4256174722:4256176170, ack 857863611, win 91, options [nop,nop,TS val 794346 ecr 837660], length 1448
17:31:20.321847 IP 1.1.2.3.57968 > 5.6.7.8.80: Flags [.], ack 4256176170, win 137, options [nop,nop,TS val 837663 ecr 794346], length 0
17:31:20.321855 IP 5.6.7.8.80 > 1.1.2.3.57968: Flags [.], seq 4256176170:4256177618, ack 857863611, win 91, options [nop,nop,TS val 794346 ecr 837660], length 1448
17:31:20.321862 IP 1.1.2.3.57968 > 5.6.7.8.80: Flags [.], ack 4256177618, win 182, options [nop,nop,TS val 837663 ecr 794346], length 0
17:31:20.321972 IP 5.6.7.8.80 > 1.1.2.3.57968: Flags [.], seq 4256177618:4256179066, ack 857863611, win 91, options [nop,nop,TS val 794346 ecr 837660], length 1448
17:31:20.321992 IP 1.1.2.3.57968 > 5.6.7.8.80: Flags [.], ack 4256179066, win 227, options [nop,nop,TS val 837663 ecr 794346], length 0
17:31:20.332307 IP 5.6.7.8.80 > 1.1.2.3.57969: Flags [S.], seq 1558304943, ack 2193250771, win 5792, options [mss 1460,sackOK,TS val 794348 ecr 837663,nop,wscale 6], length 0
17:31:20.332336 IP 1.1.2.3.57969 > 5.6.7.8.80: Flags [.], ack 1558304944, win 92, options [nop,nop,TS val 837666 ecr 794348], length 0
17:31:20.332406 IP 1.1.2.3.57969 > 5.6.7.8.80: Flags [P.], seq 2193250771:2193250887, ack 1558304944, win 92, options [nop,nop,TS val 837666 ecr 794348], length 116
17:31:20.333453 IP 5.6.7.8.80 > 1.1.2.3.57968: Flags [.], seq 4256179066:4256180514, ack 857863611, win 91, options [nop,nop,TS val 794349 ecr 837663], length 1448
17:31:20.333467 IP 1.1.2.3.57968 > 5.6.7.8.80: Flags [.], ack 4256180514, win 273, options [nop,nop,TS val 837666 ecr 794349], length 0
17:31:20.333472 IP 5.6.7.8.80 > 1.1.2.3.57968: Flags [P.], seq 4256180514:4256181090, ack 857863611, win 91, options [nop,nop,TS val 794349 ecr 837663], length 576
17:31:20.333479 IP 1.1.2.3.57968 > 5.6.7.8.80: Flags [.], ack 4256181090, win 318, options [nop,nop,TS val 837666 ecr 794349], length 0
17:31:20.333934 IP 1.1.2.3.57968 > 5.6.7.8.80: Flags [F.], seq 857863611, ack 4256181090, win 318, options [nop,nop,TS val 837666 ecr 794349], length 0
17:31:20.343938 IP 5.6.7.8.80 > 1.1.2.3.57969: Flags [.], ack 2193250887, win 91, options [nop,nop,TS val 794351 ecr 837666], length 0
17:31:20.346881 IP 5.6.7.8.80 > 1.1.2.3.57968: Flags [F.], seq 4256181090, ack 857863612, win 91, options [nop,nop,TS val 794352 ecr 837666], length 0
17:31:20.346897 IP 1.1.2.3.57968 > 5.6.7.8.80: Flags [.], ack 4256181091, win 318, options [nop,nop,TS val 837669 ecr 794352], length 0
17:31:20.346934 IP 5.6.7.8.80 > 1.1.2.3.57969: Flags [.], seq 1558304944:1558306392, ack 2193250887, win 91, options [nop,nop,TS val 794352 ecr 837666], length 1448
17:31:20.346941 IP 1.1.2.3.57969 > 5.6.7.8.80: Flags [.], ack 1558306392, win 137, options [nop,nop,TS val 837669 ecr 794352], length 0
17:31:20.346949 IP 5.6.7.8.80 > 1.1.2.3.57969: Flags [.], seq 1558306392:1558307840, ack 2193250887, win 91, options [nop,nop,TS val 794352 ecr 837666], length 1448
17:31:20.346959 IP 1.1.2.3.57969 > 5.6.7.8.80: Flags [.], ack 1558307840, win 182, options [nop,nop,TS val 837670 ecr 794352], length 0
17:31:20.346964 IP 5.6.7.8.80 > 1.1.2.3.57969: Flags [.], seq 1558307840:1558309288, ack 2193250887, win 91, options [nop,nop,TS val 794352 ecr 837666], length 1448
17:31:20.346975 IP 1.1.2.3.57969 > 5.6.7.8.80: Flags [.], ack 1558309288, win 227, options [nop,nop,TS val 837670 ecr 794352], length 0
17:31:20.358763 IP 5.6.7.8.80 > 1.1.2.3.57969: Flags [.], seq 1558309288:1558310736, ack 2193250887, win 91, options [nop,nop,TS val 794355 ecr 837669], length 1448
17:31:20.358782 IP 1.1.2.3.57969 > 5.6.7.8.80: Flags [.], ack 1558310736, win 273, options [nop,nop,TS val 837673 ecr 794355], length 0
17:31:20.358789 IP 5.6.7.8.80 > 1.1.2.3.57969: Flags [P.], seq 1558310736:1558310981, ack 2193250887, win 91, options [nop,nop,TS val 794355 ecr 837669], length 245
17:31:20.358796 IP 1.1.2.3.57969 > 5.6.7.8.80: Flags [.], ack 1558310981, win 318, options [nop,nop,TS val 837673 ecr 794355], length 0
17:31:20.359251 IP 1.1.2.3.57969 > 5.6.7.8.80: Flags [F.], seq 2193250887, ack 1558310981, win 318, options [nop,nop,TS val 837673 ecr 794355], length 0
17:31:20.370943 IP 5.6.7.8.80 > 1.1.2.3.57969: Flags [F.], seq 1558310981, ack 2193250888, win 91, options [nop,nop,TS val 794358 ecr 837673], length 0
17:31:20.370969 IP 1.1.2.3.57969 > 5.6.7.8.80: Flags [.], ack 1558310982, win 318, options [nop,nop,TS val 837676 ecr 794358], length 0
17:31:20.515966 IP 1.1.2.3.57970 > 5.6.7.8.80: Flags [S], seq 3543022480, win 5840, options [mss 1460,sackOK,TS val 837712 ecr 0,nop,wscale 6], length 0
17:31:20.527437 IP 5.6.7.8.80 > 1.1.2.3.57970: Flags [S.], seq 3187574875, ack 3543022481, win 5792, options [mss 1460,sackOK,TS val 794397 ecr 837712,nop,wscale 6], length 0
17:31:20.527472 IP 1.1.2.3.57970 > 5.6.7.8.80: Flags [.], ack 3187574876, win 92, options [nop,nop,TS val 837715 ecr 794397], length 0
17:31:20.527544 IP 1.1.2.3.57970 > 5.6.7.8.80: Flags [P.], seq 3543022481:3543022597, ack 3187574876, win 92, options [nop,nop,TS val 837715 ecr 794397], length 116
17:31:20.539066 IP 5.6.7.8.80 > 1.1.2.3.57970: Flags [.], ack 3543022597, win 91, options [nop,nop,TS val 794400 ecr 837715], length 0
17:31:20.542061 IP 5.6.7.8.80 > 1.1.2.3.57970: Flags [.], seq 3187574876:3187576324, ack 3543022597, win 91, options [nop,nop,TS val 794401 ecr 837715], length 1448
17:31:20.542072 IP 1.1.2.3.57970 > 5.6.7.8.80: Flags [.], ack 3187576324, win 137, options [nop,nop,TS val 837718 ecr 794401], length 0
17:31:20.542362 IP 5.6.7.8.80 > 1.1.2.3.57970: Flags [.], seq 3187576324:3187577772, ack 3543022597, win 91, options [nop,nop,TS val 794401 ecr 837715], length 1448
17:31:20.542376 IP 1.1.2.3.57970 > 5.6.7.8.80: Flags [.], ack 3187577772, win 182, options [nop,nop,TS val 837718 ecr 794401], length 0
17:31:20.542386 IP 5.6.7.8.80 > 1.1.2.3.57970: Flags [.], seq 3187577772:3187579220, ack 3543022597, win 91, options [nop,nop,TS val 794401 ecr 837715], length 1448
17:31:20.542396 IP 1.1.2.3.57970 > 5.6.7.8.80: Flags [.], ack 3187579220, win 227, options [nop,nop,TS val 837718 ecr 794401], length 0
17:31:20.553842 IP 5.6.7.8.80 > 1.1.2.3.57970: Flags [.], seq 3187579220:3187580668, ack 3543022597, win 91, options [nop,nop,TS val 794404 ecr 837718], length 1448
17:31:20.553854 IP 1.1.2.3.57970 > 5.6.7.8.80: Flags [.], ack 3187580668, win 273, options [nop,nop,TS val 837721 ecr 794404], length 0
17:31:20.553861 IP 5.6.7.8.80 > 1.1.2.3.57970: Flags [P.], seq 3187580668:3187582116, ack 3543022597, win 91, options [nop,nop,TS val 794404 ecr 837718], length 1448
17:31:20.553871 IP 1.1.2.3.57970 > 5.6.7.8.80: Flags [.], ack 3187582116, win 318, options [nop,nop,TS val 837721 ecr 794404], length 0
17:31:20.553941 IP 5.6.7.8.80 > 1.1.2.3.57970: Flags [.], seq 3187582116:3187583564, ack 3543022597, win 91, options [nop,nop,TS val 794404 ecr 837718], length 1448
17:31:20.553948 IP 1.1.2.3.57970 > 5.6.7.8.80: Flags [.], ack 3187583564, win 363, options [nop,nop,TS val 837721 ecr 794404], length 0
17:31:20.554091 IP 5.6.7.8.80 > 1.1.2.3.57970: Flags [P.], seq 3187583564:3187584571, ack 3543022597, win 91, options [nop,nop,TS val 794404 ecr 837718], length 1007
17:31:20.554101 IP 1.1.2.3.57970 > 5.6.7.8.80: Flags [.], ack 3187584571, win 408, options [nop,nop,TS val 837721 ecr 794404], length 0
17:31:20.554518 IP 1.1.2.3.57970 > 5.6.7.8.80: Flags [F.], seq 3543022597, ack 3187584571, win 408, options [nop,nop,TS val 837721 ecr 794404], length 0
17:31:20.566174 IP 5.6.7.8.80 > 1.1.2.3.57970: Flags [F.], seq 3187584571, ack 3543022598, win 91, options [nop,nop,TS val 794407 ecr 837721], length 0
17:31:20.566203 IP 1.1.2.3.57970 > 5.6.7.8.80: Flags [.], ack 3187584572, win 408, options [nop,nop,TS val 837724 ecr 794407], length 0
17:31:20.583061 IP 1.1.2.3.57971 > 5.6.7.8.80: Flags [S], seq 828368707, win 5840, options [mss 1460,sackOK,TS val 837728 ecr 0,nop,wscale 6], length 0
17:31:20.594527 IP 5.6.7.8.80 > 1.1.2.3.57971: Flags [S.], seq 387723966, ack 828368708, win 5792, options [mss 1460,sackOK,TS val 794414 ecr 837728,nop,wscale 6], length 0
17:31:20.594563 IP 1.1.2.3.57971 > 5.6.7.8.80: Flags [.], ack 387723967, win 92, options [nop,nop,TS val 837731 ecr 794414], length 0
17:31:20.594629 IP 1.1.2.3.57971 > 5.6.7.8.80: Flags [P.], seq 828368708:828368824, ack 387723967, win 92, options [nop,nop,TS val 837731 ecr 794414], length 116
17:31:20.606456 IP 5.6.7.8.80 > 1.1.2.3.57971: Flags [.], ack 828368824, win 91, options [nop,nop,TS val 794417 ecr 837731], length 0
17:31:20.608402 IP 5.6.7.8.80 > 1.1.2.3.57971: Flags [.], seq 387723967:387725415, ack 828368824, win 91, options [nop,nop,TS val 794418 ecr 837731], length 1448
17:31:20.608413 IP 1.1.2.3.57971 > 5.6.7.8.80: Flags [.], ack 387725415, win 137, options [nop,nop,TS val 837735 ecr 794418], length 0
17:31:20.608552 IP 5.6.7.8.80 > 1.1.2.3.57971: Flags [P.], seq 387725415:387726658, ack 828368824, win 91, options [nop,nop,TS val 794418 ecr 837731], length 1243
17:31:20.608575 IP 1.1.2.3.57971 > 5.6.7.8.80: Flags [.], ack 387726658, win 182, options [nop,nop,TS val 837735 ecr 794418], length 0
17:31:20.608998 IP 1.1.2.3.57971 > 5.6.7.8.80: Flags [F.], seq 828368824, ack 387726658, win 182, options [nop,nop,TS val 837735 ecr 794418], length 0
17:31:20.620384 IP 5.6.7.8.80 > 1.1.2.3.57971: Flags [F.], seq 387726658, ack 828368825, win 91, options [nop,nop,TS val 794420 ecr 837735], length 0
17:31:20.620410 IP 1.1.2.3.57971 > 5.6.7.8.80: Flags [.], ack 387726659, win 182, options [nop,nop,TS val 837738 ecr 794420], length 0
17:31:20.670999 IP 5.6.7.8.80 > 1.1.2.3.57966: Flags [.], seq 1816469642:1816471090, ack 2318371183, win 91, options [nop,nop,TS val 794433 ecr 837538], length 1448
17:31:20.671018 IP 1.1.2.3.57966 > 5.6.7.8.80: Flags [.], ack 1816471090, win 137, options [nop,nop,TS val 837751 ecr 794433], length 0
17:31:20.671024 IP 5.6.7.8.80 > 1.1.2.3.57966: Flags [.], seq 1816471090:1816472538, ack 2318371183, win 91, options [nop,nop,TS val 794433 ecr 837538], length 1448
17:31:20.671030 IP 1.1.2.3.57966 > 5.6.7.8.80: Flags [.], ack 1816472538, win 182, options [nop,nop,TS val 837751 ecr 794433], length 0
17:31:20.671034 IP 5.6.7.8.80 > 1.1.2.3.57966: Flags [.], seq 1816472538:1816473986, ack 2318371183, win 91, options [nop,nop,TS val 794433 ecr 837538], length 1448
17:31:20.671041 IP 1.1.2.3.57966 > 5.6.7.8.80: Flags [.], ack 1816473986, win 227, options [nop,nop,TS val 837751 ecr 794433], length 0
17:31:20.682830 IP 5.6.7.8.80 > 1.1.2.3.57966: Flags [.], seq 1816473986:1816475434, ack 2318371183, win 91, options [nop,nop,TS val 794436 ecr 837751], length 1448
17:31:20.682847 IP 1.1.2.3.57966 > 5.6.7.8.80: Flags [.], ack 1816475434, win 273, options [nop,nop,TS val 837754 ecr 794436], length 0
17:31:20.682853 IP 5.6.7.8.80 > 1.1.2.3.57966: Flags [P.], seq 1816475434:1816476882, ack 2318371183, win 91, options [nop,nop,TS val 794436 ecr 837751], length 1448
17:31:20.682859 IP 1.1.2.3.57966 > 5.6.7.8.80: Flags [.], ack 1816476882, win 318, options [nop,nop,TS val 837754 ecr 794436], length 0
17:31:20.682979 IP 5.6.7.8.80 > 1.1.2.3.57966: Flags [.], seq 1816476882:1816478330, ack 2318371183, win 91, options [nop,nop,TS val 794436 ecr 837751], length 1448
17:31:20.682988 IP 1.1.2.3.57966 > 5.6.7.8.80: Flags [.], ack 1816478330, win 363, options [nop,nop,TS val 837754 ecr 794436], length 0
17:31:20.682994 IP 5.6.7.8.80 > 1.1.2.3.57966: Flags [P.], seq 1816478330:1816479584, ack 2318371183, win 91, options [nop,nop,TS val 794436 ecr 837751], length 1254
17:31:20.683000 IP 1.1.2.3.57966 > 5.6.7.8.80: Flags [.], ack 1816479584, win 408, options [nop,nop,TS val 837754 ecr 794436], length 0
17:31:20.683460 IP 1.1.2.3.57966 > 5.6.7.8.80: Flags [F.], seq 2318371183, ack 1816479584, win 408, options [nop,nop,TS val 837754 ecr 794436], length 0
17:31:20.695211 IP 5.6.7.8.80 > 1.1.2.3.57966: Flags [F.], seq 1816479584, ack 2318371184, win 91, options [nop,nop,TS val 794439 ecr 837754], length 0
17:31:20.695238 IP 1.1.2.3.57966 > 5.6.7.8.80: Flags [.], ack 1816479585, win 408, options [nop,nop,TS val 837757 ecr 794439], length 0
17:31:20.847613 IP 1.1.2.3.57972 > 5.6.7.8.80: Flags [S], seq 406706257, win 5840, options [mss 1460,sackOK,TS val 837795 ecr 0,nop,wscale 6], length 0
17:31:20.859293 IP 5.6.7.8.80 > 1.1.2.3.57972: Flags [S.], seq 4049347315, ack 406706258, win 5792, options [mss 1460,sackOK,TS val 794480 ecr 837795,nop,wscale 6], length 0
17:31:20.859328 IP 1.1.2.3.57972 > 5.6.7.8.80: Flags [.], ack 4049347316, win 92, options [nop,nop,TS val 837798 ecr 794480], length 0
17:31:20.859390 IP 1.1.2.3.57972 > 5.6.7.8.80: Flags [P.], seq 406706258:406706374, ack 4049347316, win 92, options [nop,nop,TS val 837798 ecr 794480], length 116
17:31:20.871521 IP 5.6.7.8.80 > 1.1.2.3.57972: Flags [.], ack 406706374, win 91, options [nop,nop,TS val 794483 ecr 837798], length 0
17:31:20.873018 IP 5.6.7.8.80 > 1.1.2.3.57972: Flags [.], seq 4049347316:4049348764, ack 406706374, win 91, options [nop,nop,TS val 794484 ecr 837798], length 1448
17:31:20.873029 IP 1.1.2.3.57972 > 5.6.7.8.80: Flags [.], ack 4049348764, win 137, options [nop,nop,TS val 837801 ecr 794484], length 0
17:31:20.873036 IP 5.6.7.8.80 > 1.1.2.3.57972: Flags [P.], seq 4049348764:4049348811, ack 406706374, win 91, options [nop,nop,TS val 794484 ecr 837798], length 47
17:31:20.873043 IP 1.1.2.3.57972 > 5.6.7.8.80: Flags [.], ack 4049348811, win 137, options [nop,nop,TS val 837801 ecr 794484], length 0
17:31:20.873587 IP 1.1.2.3.57972 > 5.6.7.8.80: Flags [F.], seq 406706374, ack 4049348811, win 137, options [nop,nop,TS val 837801 ecr 794484], length 0
17:31:20.885099 IP 5.6.7.8.80 > 1.1.2.3.57972: Flags [F.], seq 4049348811, ack 406706375, win 91, options [nop,nop,TS val 794487 ecr 837801], length 0
17:31:20.885127 IP 1.1.2.3.57972 > 5.6.7.8.80: Flags [.], ack 4049348812, win 137, options [nop,nop,TS val 837804 ecr 794487], length 0
17:31:21.674641 IP 1.1.2.3.57973 > 5.6.7.8.80: Flags [S], seq 3488090189, win 5840, options [mss 1460,sackOK,TS val 838002 ecr 0,nop,wscale 6], length 0
17:31:21.686152 IP 5.6.7.8.80 > 1.1.2.3.57973: Flags [S.], seq 3019870541, ack 3488090190, win 5792, options [mss 1460,sackOK,TS val 794687 ecr 838002,nop,wscale 6], length 0
17:31:21.686237 IP 1.1.2.3.57973 > 5.6.7.8.80: Flags [.], ack 3019870542, win 92, options [nop,nop,TS val 838004 ecr 794687], length 0
17:31:21.686448 IP 1.1.2.3.57973 > 5.6.7.8.80: Flags [P.], seq 3488090190:3488090306, ack 3019870542, win 92, options [nop,nop,TS val 838004 ecr 794687], length 116
17:31:21.688408 IP 1.1.2.3.57974 > 5.6.7.8.80: Flags [S], seq 3725069440, win 5840, options [mss 1460,sackOK,TS val 838005 ecr 0,nop,wscale 6], length 0
17:31:21.698115 IP 5.6.7.8.80 > 1.1.2.3.57973: Flags [.], ack 3488090306, win 91, options [nop,nop,TS val 794690 ecr 838004], length 0
17:31:21.699861 IP 5.6.7.8.80 > 1.1.2.3.57974: Flags [S.], seq 1519535721, ack 3725069441, win 5792, options [mss 1460,sackOK,TS val 794690 ecr 838005,nop,wscale 6], length 0
17:31:21.699883 IP 1.1.2.3.57974 > 5.6.7.8.80: Flags [.], ack 1519535722, win 92, options [nop,nop,TS val 838008 ecr 794690], length 0
17:31:21.699950 IP 1.1.2.3.57974 > 5.6.7.8.80: Flags [P.], seq 3725069441:3725069557, ack 1519535722, win 92, options [nop,nop,TS val 838008 ecr 794690], length 116
17:31:21.700409 IP 5.6.7.8.80 > 1.1.2.3.57973: Flags [.], seq 3019870542:3019871990, ack 3488090306, win 91, options [nop,nop,TS val 794691 ecr 838004], length 1448
17:31:21.700422 IP 1.1.2.3.57973 > 5.6.7.8.80: Flags [.], ack 3019871990, win 137, options [nop,nop,TS val 838008 ecr 794691], length 0
17:31:21.700661 IP 5.6.7.8.80 > 1.1.2.3.57973: Flags [.], seq 3019871990:3019873438, ack 3488090306, win 91, options [nop,nop,TS val 794691 ecr 838004], length 1448
17:31:21.700676 IP 1.1.2.3.57973 > 5.6.7.8.80: Flags [.], ack 3019873438, win 182, options [nop,nop,TS val 838008 ecr 794691], length 0
17:31:21.700682 IP 5.6.7.8.80 > 1.1.2.3.57973: Flags [P.], seq 3019873438:3019873520, ack 3488090306, win 91, options [nop,nop,TS val 794691 ecr 838004], length 82
17:31:21.700689 IP 1.1.2.3.57973 > 5.6.7.8.80: Flags [.], ack 3019873520, win 182, options [nop,nop,TS val 838008 ecr 794691], length 0
17:31:21.701134 IP 1.1.2.3.57973 > 5.6.7.8.80: Flags [F.], seq 3488090306, ack 3019873520, win 182, options [nop,nop,TS val 838008 ecr 794691], length 0
17:31:21.711493 IP 5.6.7.8.80 > 1.1.2.3.57974: Flags [.], ack 3725069557, win 91, options [nop,nop,TS val 794693 ecr 838008], length 0
17:31:21.712790 IP 5.6.7.8.80 > 1.1.2.3.57973: Flags [F.], seq 3019873520, ack 3488090307, win 91, options [nop,nop,TS val 794693 ecr 838008], length 0
17:31:21.712804 IP 1.1.2.3.57973 > 5.6.7.8.80: Flags [.], ack 3019873521, win 182, options [nop,nop,TS val 838011 ecr 794693], length 0
17:31:21.714137 IP 5.6.7.8.80 > 1.1.2.3.57974: Flags [.], seq 1519535722:1519537170, ack 3725069557, win 91, options [nop,nop,TS val 794694 ecr 838008], length 1448
17:31:21.714147 IP 1.1.2.3.57974 > 5.6.7.8.80: Flags [.], ack 1519537170, win 137, options [nop,nop,TS val 838011 ecr 794694], length 0
17:31:21.714290 IP 5.6.7.8.80 > 1.1.2.3.57974: Flags [.], seq 1519537170:1519538618, ack 3725069557, win 91, options [nop,nop,TS val 794694 ecr 838008], length 1448
17:31:21.714314 IP 1.1.2.3.57974 > 5.6.7.8.80: Flags [.], ack 1519538618, win 182, options [nop,nop,TS val 838011 ecr 794694], length 0
17:31:21.714321 IP 5.6.7.8.80 > 1.1.2.3.57974: Flags [.], seq 1519538618:1519540066, ack 3725069557, win 91, options [nop,nop,TS val 794694 ecr 838008], length 1448
17:31:21.714330 IP 1.1.2.3.57974 > 5.6.7.8.80: Flags [.], ack 1519540066, win 227, options [nop,nop,TS val 838011 ecr 794694], length 0
17:31:21.725768 IP 5.6.7.8.80 > 1.1.2.3.57974: Flags [.], seq 1519540066:1519541514, ack 3725069557, win 91, options [nop,nop,TS val 794697 ecr 838011], length 1448
17:31:21.725780 IP 1.1.2.3.57974 > 5.6.7.8.80: Flags [.], ack 1519541514, win 273, options [nop,nop,TS val 838014 ecr 794697], length 0
17:31:21.725867 IP 5.6.7.8.80 > 1.1.2.3.57974: Flags [P.], seq 1519541514:1519542962, ack 3725069557, win 91, options [nop,nop,TS val 794697 ecr 838011], length 1448
17:31:21.725877 IP 1.1.2.3.57974 > 5.6.7.8.80: Flags [.], ack 1519542962, win 318, options [nop,nop,TS val 838014 ecr 794697], length 0
17:31:21.725885 IP 5.6.7.8.80 > 1.1.2.3.57974: Flags [.], seq 1519542962:1519544410, ack 3725069557, win 91, options [nop,nop,TS val 794697 ecr 838011], length 1448
17:31:21.725895 IP 1.1.2.3.57974 > 5.6.7.8.80: Flags [.], ack 1519544410, win 363, options [nop,nop,TS val 838014 ecr 794697], length 0
17:31:21.725900 IP 5.6.7.8.80 > 1.1.2.3.57974: Flags [P.], seq 1519544410:1519544711, ack 3725069557, win 91, options [nop,nop,TS val 794697 ecr 838011], length 301
17:31:21.725931 IP 1.1.2.3.57974 > 5.6.7.8.80: Flags [.], ack 1519544711, win 408, options [nop,nop,TS val 838014 ecr 794697], length 0
17:31:21.726370 IP 1.1.2.3.57974 > 5.6.7.8.80: Flags [F.], seq 3725069557, ack 1519544711, win 408, options [nop,nop,TS val 838014 ecr 794697], length 0
17:31:21.737851 IP 5.6.7.8.80 > 1.1.2.3.57974: Flags [F.], seq 1519544711, ack 3725069558, win 91, options [nop,nop,TS val 794700 ecr 838014], length 0
17:31:21.737879 IP 1.1.2.3.57974 > 5.6.7.8.80: Flags [.], ack 1519544712, win 408, options [nop,nop,TS val 838017 ecr 794700], length 0
17:31:21.820141 IP 1.1.2.3.57975 > 5.6.7.8.80: Flags [S], seq 1071085361, win 5840, options [mss 1460,sackOK,TS val 838038 ecr 0,nop,wscale 6], length 0
17:31:21.831697 IP 5.6.7.8.80 > 1.1.2.3.57975: Flags [S.], seq 3909074130, ack 1071085362, win 5792, options [mss 1460,sackOK,TS val 794723 ecr 838038,nop,wscale 6], length 0
17:31:21.831733 IP 1.1.2.3.57975 > 5.6.7.8.80: Flags [.], ack 3909074131, win 92, options [nop,nop,TS val 838041 ecr 794723], length 0
17:31:21.831794 IP 1.1.2.3.57975 > 5.6.7.8.80: Flags [P.], seq 1071085362:1071085478, ack 3909074131, win 92, options [nop,nop,TS val 838041 ecr 794723], length 116
17:31:21.843426 IP 5.6.7.8.80 > 1.1.2.3.57975: Flags [.], ack 1071085478, win 91, options [nop,nop,TS val 794726 ecr 838041], length 0
17:31:21.846071 IP 5.6.7.8.80 > 1.1.2.3.57975: Flags [.], seq 3909074131:3909075579, ack 1071085478, win 91, options [nop,nop,TS val 794727 ecr 838041], length 1448
17:31:21.846081 IP 1.1.2.3.57975 > 5.6.7.8.80: Flags [.], ack 3909075579, win 137, options [nop,nop,TS val 838044 ecr 794727], length 0
17:31:21.846089 IP 5.6.7.8.80 > 1.1.2.3.57975: Flags [.], seq 3909075579:3909077027, ack 1071085478, win 91, options [nop,nop,TS val 794727 ecr 838041], length 1448
17:31:21.846099 IP 1.1.2.3.57975 > 5.6.7.8.80: Flags [.], ack 3909077027, win 182, options [nop,nop,TS val 838044 ecr 794727], length 0
17:31:21.846105 IP 5.6.7.8.80 > 1.1.2.3.57975: Flags [.], seq 3909077027:3909078475, ack 1071085478, win 91, options [nop,nop,TS val 794727 ecr 838041], length 1448
17:31:21.846124 IP 1.1.2.3.57975 > 5.6.7.8.80: Flags [.], ack 3909078475, win 227, options [nop,nop,TS val 838044 ecr 794727], length 0
17:31:21.857804 IP 5.6.7.8.80 > 1.1.2.3.57975: Flags [.], seq 3909078475:3909079923, ack 1071085478, win 91, options [nop,nop,TS val 794730 ecr 838044], length 1448
17:31:21.857820 IP 1.1.2.3.57975 > 5.6.7.8.80: Flags [.], ack 3909079923, win 273, options [nop,nop,TS val 838047 ecr 794730], length 0
17:31:21.857828 IP 5.6.7.8.80 > 1.1.2.3.57975: Flags [P.], seq 3909079923:3909080652, ack 1071085478, win 91, options [nop,nop,TS val 794730 ecr 838044], length 729
17:31:21.857838 IP 1.1.2.3.57975 > 5.6.7.8.80: Flags [.], ack 3909080652, win 318, options [nop,nop,TS val 838047 ecr 794730], length 0
17:31:21.858264 IP 1.1.2.3.57975 > 5.6.7.8.80: Flags [F.], seq 1071085478, ack 3909080652, win 318, options [nop,nop,TS val 838048 ecr 794730], length 0
17:31:21.870083 IP 5.6.7.8.80 > 1.1.2.3.57975: Flags [F.], seq 3909080652, ack 1071085479, win 91, options [nop,nop,TS val 794733 ecr 838048], length 0
17:31:21.870112 IP 1.1.2.3.57975 > 5.6.7.8.80: Flags [.], ack 3909080653, win 318, options [nop,nop,TS val 838050 ecr 794733], length 0
17:31:22.101844 IP 1.1.2.3.57976 > 5.6.7.8.80: Flags [S], seq 633542388, win 5840, options [mss 1460,sackOK,TS val 838108 ecr 0,nop,wscale 6], length 0
17:31:22.113883 IP 5.6.7.8.80 > 1.1.2.3.57976: Flags [S.], seq 1787298430, ack 633542389, win 5792, options [mss 1460,sackOK,TS val 794794 ecr 838108,nop,wscale 6], length 0
17:31:22.113917 IP 1.1.2.3.57976 > 5.6.7.8.80: Flags [.], ack 1787298431, win 92, options [nop,nop,TS val 838111 ecr 794794], length 0
17:31:22.113986 IP 1.1.2.3.57976 > 5.6.7.8.80: Flags [P.], seq 633542389:633542505, ack 1787298431, win 92, options [nop,nop,TS val 838111 ecr 794794], length 116
17:31:22.125513 IP 5.6.7.8.80 > 1.1.2.3.57976: Flags [.], ack 633542505, win 91, options [nop,nop,TS val 794797 ecr 838111], length 0
17:31:22.128058 IP 5.6.7.8.80 > 1.1.2.3.57976: Flags [.], seq 1787298431:1787299879, ack 633542505, win 91, options [nop,nop,TS val 794797 ecr 838111], length 1448
17:31:22.128070 IP 1.1.2.3.57976 > 5.6.7.8.80: Flags [.], ack 1787299879, win 137, options [nop,nop,TS val 838115 ecr 794797], length 0
17:31:22.128077 IP 5.6.7.8.80 > 1.1.2.3.57976: Flags [P.], seq 1787299879:1787300215, ack 633542505, win 91, options [nop,nop,TS val 794797 ecr 838111], length 336
17:31:22.128083 IP 1.1.2.3.57976 > 5.6.7.8.80: Flags [.], ack 1787300215, win 182, options [nop,nop,TS val 838115 ecr 794797], length 0
17:31:22.128616 IP 1.1.2.3.57976 > 5.6.7.8.80: Flags [F.], seq 633542505, ack 1787300215, win 182, options [nop,nop,TS val 838115 ecr 794797], length 0
17:31:22.140240 IP 5.6.7.8.80 > 1.1.2.3.57976: Flags [F.], seq 1787300215, ack 633542506, win 91, options [nop,nop,TS val 794801 ecr 838115], length 0
17:31:22.140269 IP 1.1.2.3.57976 > 5.6.7.8.80: Flags [.], ack 1787300216, win 182, options [nop,nop,TS val 838118 ecr 794801], length 0
17:31:22.171155 IP 1.1.2.3.57977 > 5.6.7.8.80: Flags [S], seq 778385279, win 5840, options [mss 1460,sackOK,TS val 838126 ecr 0,nop,wscale 6], length 0
17:31:22.183019 IP 5.6.7.8.80 > 1.1.2.3.57977: Flags [S.], seq 3207092248, ack 778385280, win 5792, options [mss 1460,sackOK,TS val 794811 ecr 838126,nop,wscale 6], length 0
17:31:22.183053 IP 1.1.2.3.57977 > 5.6.7.8.80: Flags [.], ack 3207092249, win 92, options [nop,nop,TS val 838129 ecr 794811], length 0
17:31:22.183124 IP 1.1.2.3.57977 > 5.6.7.8.80: Flags [P.], seq 778385280:778385396, ack 3207092249, win 92, options [nop,nop,TS val 838129 ecr 794811], length 116
17:31:22.194998 IP 5.6.7.8.80 > 1.1.2.3.57977: Flags [.], ack 778385396, win 91, options [nop,nop,TS val 794814 ecr 838129], length 0
17:31:22.197095 IP 5.6.7.8.80 > 1.1.2.3.57977: Flags [.], seq 3207092249:3207093697, ack 778385396, win 91, options [nop,nop,TS val 794815 ecr 838129], length 1448
17:31:22.197107 IP 1.1.2.3.57977 > 5.6.7.8.80: Flags [.], ack 3207093697, win 137, options [nop,nop,TS val 838132 ecr 794815], length 0
17:31:22.197244 IP 5.6.7.8.80 > 1.1.2.3.57977: Flags [.], seq 3207093697:3207095145, ack 778385396, win 91, options [nop,nop,TS val 794815 ecr 838129], length 1448
17:31:22.197264 IP 1.1.2.3.57977 > 5.6.7.8.80: Flags [.], ack 3207095145, win 182, options [nop,nop,TS val 838132 ecr 794815], length 0
17:31:22.197269 IP 5.6.7.8.80 > 1.1.2.3.57977: Flags [P.], seq 3207095145:3207096159, ack 778385396, win 91, options [nop,nop,TS val 794815 ecr 838129], length 1014
17:31:22.197278 IP 1.1.2.3.57977 > 5.6.7.8.80: Flags [.], ack 3207096159, win 227, options [nop,nop,TS val 838132 ecr 794815], length 0
17:31:22.197731 IP 1.1.2.3.57977 > 5.6.7.8.80: Flags [F.], seq 778385396, ack 3207096159, win 227, options [nop,nop,TS val 838132 ecr 794815], length 0
17:31:22.209475 IP 5.6.7.8.80 > 1.1.2.3.57977: Flags [F.], seq 3207096159, ack 778385397, win 91, options [nop,nop,TS val 794818 ecr 838132], length 0
17:31:22.209503 IP 1.1.2.3.57977 > 5.6.7.8.80: Flags [.], ack 3207096160, win 227, options [nop,nop,TS val 838135 ecr 794818], length 0
17:31:22.353703 IP 1.1.2.3.57978 > 5.6.7.8.80: Flags [S], seq 3827908473, win 5840, options [mss 1460,sackOK,TS val 838171 ecr 0,nop,wscale 6], length 0
17:31:22.365670 IP 5.6.7.8.80 > 1.1.2.3.57978: Flags [S.], seq 2837157664, ack 3827908474, win 5792, options [mss 1460,sackOK,TS val 794857 ecr 838171,nop,wscale 6], length 0
17:31:22.365705 IP 1.1.2.3.57978 > 5.6.7.8.80: Flags [.], ack 2837157665, win 92, options [nop,nop,TS val 838174 ecr 794857], length 0
17:31:22.365775 IP 1.1.2.3.57978 > 5.6.7.8.80: Flags [P.], seq 3827908474:3827908590, ack 2837157665, win 92, options [nop,nop,TS val 838174 ecr 794857], length 116
17:31:22.377649 IP 5.6.7.8.80 > 1.1.2.3.57978: Flags [.], ack 3827908590, win 91, options [nop,nop,TS val 794860 ecr 838174], length 0
17:31:22.379745 IP 5.6.7.8.80 > 1.1.2.3.57978: Flags [.], seq 2837157665:2837159113, ack 3827908590, win 91, options [nop,nop,TS val 794860 ecr 838174], length 1448
17:31:22.379756 IP 1.1.2.3.57978 > 5.6.7.8.80: Flags [.], ack 2837159113, win 137, options [nop,nop,TS val 838178 ecr 794860], length 0
17:31:22.379763 IP 5.6.7.8.80 > 1.1.2.3.57978: Flags [.], seq 2837159113:2837160561, ack 3827908590, win 91, options [nop,nop,TS val 794860 ecr 838174], length 1448
17:31:22.379770 IP 1.1.2.3.57978 > 5.6.7.8.80: Flags [.], ack 2837160561, win 182, options [nop,nop,TS val 838178 ecr 794860], length 0
17:31:22.379775 IP 5.6.7.8.80 > 1.1.2.3.57978: Flags [P.], seq 2837160561:2837161615, ack 3827908590, win 91, options [nop,nop,TS val 794860 ecr 838174], length 1054
17:31:22.379783 IP 1.1.2.3.57978 > 5.6.7.8.80: Flags [.], ack 2837161615, win 227, options [nop,nop,TS val 838178 ecr 794860], length 0
17:31:22.380349 IP 1.1.2.3.57978 > 5.6.7.8.80: Flags [F.], seq 3827908590, ack 2837161615, win 227, options [nop,nop,TS val 838178 ecr 794860], length 0
17:31:22.388066 IP 1.1.2.3.57979 > 5.6.7.8.80: Flags [S], seq 2347034520, win 5840, options [mss 1460,sackOK,TS val 838180 ecr 0,nop,wscale 6], length 0
17:31:22.392076 IP 5.6.7.8.80 > 1.1.2.3.57978: Flags [F.], seq 2837161615, ack 3827908591, win 91, options [nop,nop,TS val 794863 ecr 838178], length 0
17:31:22.392107 IP 1.1.2.3.57978 > 5.6.7.8.80: Flags [.], ack 2837161616, win 227, options [nop,nop,TS val 838181 ecr 794863], length 0
17:31:22.400011 IP 5.6.7.8.80 > 1.1.2.3.57979: Flags [S.], seq 1014310668, ack 2347034521, win 5792, options [mss 1460,sackOK,TS val 794865 ecr 838180,nop,wscale 6], length 0
17:31:22.400034 IP 1.1.2.3.57979 > 5.6.7.8.80: Flags [.], ack 1014310669, win 92, options [nop,nop,TS val 838183 ecr 794865], length 0
17:31:22.400096 IP 1.1.2.3.57979 > 5.6.7.8.80: Flags [P.], seq 2347034521:2347034637, ack 1014310669, win 92, options [nop,nop,TS val 838183 ecr 794865], length 116
17:31:22.411593 IP 5.6.7.8.80 > 1.1.2.3.57979: Flags [.], ack 2347034637, win 91, options [nop,nop,TS val 794868 ecr 838183], length 0
17:31:22.414238 IP 5.6.7.8.80 > 1.1.2.3.57979: Flags [.], seq 1014310669:1014312117, ack 2347034637, win 91, options [nop,nop,TS val 794869 ecr 838183], length 1448
17:31:22.414249 IP 1.1.2.3.57979 > 5.6.7.8.80: Flags [.], ack 1014312117, win 137, options [nop,nop,TS val 838186 ecr 794869], length 0
17:31:22.414257 IP 5.6.7.8.80 > 1.1.2.3.57979: Flags [.], seq 1014312117:1014313565, ack 2347034637, win 91, options [nop,nop,TS val 794869 ecr 838183], length 1448
17:31:22.414268 IP 1.1.2.3.57979 > 5.6.7.8.80: Flags [.], ack 1014313565, win 182, options [nop,nop,TS val 838187 ecr 794869], length 0
17:31:22.414275 IP 5.6.7.8.80 > 1.1.2.3.57979: Flags [.], seq 1014313565:1014315013, ack 2347034637, win 91, options [nop,nop,TS val 794869 ecr 838183], length 1448
17:31:22.414296 IP 1.1.2.3.57979 > 5.6.7.8.80: Flags [.], ack 1014315013, win 227, options [nop,nop,TS val 838187 ecr 794869], length 0
17:31:22.425719 IP 5.6.7.8.80 > 1.1.2.3.57979: Flags [P.], seq 1014315013:1014315274, ack 2347034637, win 91, options [nop,nop,TS val 794872 ecr 838186], length 261
17:31:22.425737 IP 1.1.2.3.57979 > 5.6.7.8.80: Flags [.], ack 1014315274, win 273, options [nop,nop,TS val 838189 ecr 794872], length 0
17:31:22.426167 IP 1.1.2.3.57979 > 5.6.7.8.80: Flags [F.], seq 2347034637, ack 1014315274, win 273, options [nop,nop,TS val 838189 ecr 794872], length 0
17:31:22.437701 IP 5.6.7.8.80 > 1.1.2.3.57979: Flags [F.], seq 1014315274, ack 2347034638, win 91, options [nop,nop,TS val 794875 ecr 838189], length 0
17:31:22.437731 IP 1.1.2.3.57979 > 5.6.7.8.80: Flags [.], ack 1014315275, win 273, options [nop,nop,TS val 838192 ecr 794875], length 0
17:31:22.497353 IP 1.1.2.3.57980 > 5.6.7.8.80: Flags [S], seq 1373554396, win 5840, options [mss 1460,sackOK,TS val 838207 ecr 0,nop,wscale 6], length 0
17:31:22.508785 IP 5.6.7.8.80 > 1.1.2.3.57980: Flags [S.], seq 1796874397, ack 1373554397, win 5792, options [mss 1460,sackOK,TS val 794893 ecr 838207,nop,wscale 6], length 0
17:31:22.508821 IP 1.1.2.3.57980 > 5.6.7.8.80: Flags [.], ack 1796874398, win 92, options [nop,nop,TS val 838210 ecr 794893], length 0
17:31:22.508886 IP 1.1.2.3.57980 > 5.6.7.8.80: Flags [P.], seq 1373554397:1373554513, ack 1796874398, win 92, options [nop,nop,TS val 838210 ecr 794893], length 116
17:31:22.520414 IP 5.6.7.8.80 > 1.1.2.3.57980: Flags [.], ack 1373554513, win 91, options [nop,nop,TS val 794896 ecr 838210], length 0
17:31:22.522910 IP 5.6.7.8.80 > 1.1.2.3.57980: Flags [.], seq 1796874398:1796875846, ack 1373554513, win 91, options [nop,nop,TS val 794896 ecr 838210], length 1448
17:31:22.522921 IP 1.1.2.3.57980 > 5.6.7.8.80: Flags [.], ack 1796875846, win 137, options [nop,nop,TS val 838214 ecr 794896], length 0
17:31:22.522928 IP 5.6.7.8.80 > 1.1.2.3.57980: Flags [.], seq 1796875846:1796877294, ack 1373554513, win 91, options [nop,nop,TS val 794896 ecr 838210], length 1448
17:31:22.522935 IP 1.1.2.3.57980 > 5.6.7.8.80: Flags [.], ack 1796877294, win 182, options [nop,nop,TS val 838214 ecr 794896], length 0
17:31:22.522940 IP 5.6.7.8.80 > 1.1.2.3.57980: Flags [.], seq 1796877294:1796878742, ack 1373554513, win 91, options [nop,nop,TS val 794896 ecr 838210], length 1448
17:31:22.522949 IP 1.1.2.3.57980 > 5.6.7.8.80: Flags [.], ack 1796878742, win 227, options [nop,nop,TS val 838214 ecr 794896], length 0
17:31:22.534542 IP 5.6.7.8.80 > 1.1.2.3.57980: Flags [.], seq 1796878742:1796880190, ack 1373554513, win 91, options [nop,nop,TS val 794899 ecr 838214], length 1448
17:31:22.534558 IP 1.1.2.3.57980 > 5.6.7.8.80: Flags [.], ack 1796880190, win 273, options [nop,nop,TS val 838217 ecr 794899], length 0
17:31:22.534565 IP 5.6.7.8.80 > 1.1.2.3.57980: Flags [P.], seq 1796880190:1796881638, ack 1373554513, win 91, options [nop,nop,TS val 794899 ecr 838214], length 1448
17:31:22.534571 IP 1.1.2.3.57980 > 5.6.7.8.80: Flags [.], ack 1796881638, win 318, options [nop,nop,TS val 838217 ecr 794899], length 0
17:31:22.534576 IP 5.6.7.8.80 > 1.1.2.3.57980: Flags [.], seq 1796881638:1796883086, ack 1373554513, win 91, options [nop,nop,TS val 794899 ecr 838214], length 1448
17:31:22.534582 IP 1.1.2.3.57980 > 5.6.7.8.80: Flags [.], ack 1796883086, win 363, options [nop,nop,TS val 838217 ecr 794899], length 0
17:31:22.534587 IP 5.6.7.8.80 > 1.1.2.3.57980: Flags [P.], seq 1796883086:1796883247, ack 1373554513, win 91, options [nop,nop,TS val 794899 ecr 838214], length 161
17:31:22.534593 IP 1.1.2.3.57980 > 5.6.7.8.80: Flags [.], ack 1796883247, win 408, options [nop,nop,TS val 838217 ecr 794899], length 0
17:31:22.535141 IP 1.1.2.3.57980 > 5.6.7.8.80: Flags [F.], seq 1373554513, ack 1796883247, win 408, options [nop,nop,TS val 838217 ecr 794899], length 0
17:31:22.545870 IP 1.1.2.3.57981 > 5.6.7.8.80: Flags [S], seq 2668437748, win 5840, options [mss 1460,sackOK,TS val 838219 ecr 0,nop,wscale 6], length 0
17:31:22.546773 IP 5.6.7.8.80 > 1.1.2.3.57980: Flags [F.], seq 1796883247, ack 1373554514, win 91, options [nop,nop,TS val 794902 ecr 838217], length 0
17:31:22.546803 IP 1.1.2.3.57980 > 5.6.7.8.80: Flags [.], ack 1796883248, win 408, options [nop,nop,TS val 838220 ecr 794902], length 0
17:31:22.557253 IP 5.6.7.8.80 > 1.1.2.3.57981: Flags [S.], seq 2873533087, ack 2668437749, win 5792, options [mss 1460,sackOK,TS val 794905 ecr 838219,nop,wscale 6], length 0
17:31:22.557274 IP 1.1.2.3.57981 > 5.6.7.8.80: Flags [.], ack 2873533088, win 92, options [nop,nop,TS val 838222 ecr 794905], length 0
17:31:22.557336 IP 1.1.2.3.57981 > 5.6.7.8.80: Flags [P.], seq 2668437749:2668437865, ack 2873533088, win 92, options [nop,nop,TS val 838222 ecr 794905], length 116
17:31:22.569085 IP 5.6.7.8.80 > 1.1.2.3.57981: Flags [.], ack 2668437865, win 91, options [nop,nop,TS val 794908 ecr 838222], length 0
17:31:22.572429 IP 5.6.7.8.80 > 1.1.2.3.57981: Flags [.], seq 2873533088:2873534536, ack 2668437865, win 91, options [nop,nop,TS val 794908 ecr 838222], length 1448
17:31:22.572440 IP 1.1.2.3.57981 > 5.6.7.8.80: Flags [.], ack 2873534536, win 137, options [nop,nop,TS val 838226 ecr 794908], length 0
