17:38:03.207690 IP 1.1.2.3.58879 > 5.6.7.8.80: Flags [S], seq 3644276283, win 5840, options [mss 1460,sackOK,TS val 938385 ecr 0,nop,wscale 6], length 0
17:38:03.219247 IP 5.6.7.8.80 > 1.1.2.3.58879: Flags [S.], seq 3106365517, ack 3644276284, win 5792, options [mss 1460,sackOK,TS val 895069 ecr 938385,nop,wscale 6], length 0
17:38:03.219285 IP 1.1.2.3.58879 > 5.6.7.8.80: Flags [.], ack 3106365518, win 92, options [nop,nop,TS val 938388 ecr 895069], length 0
17:38:03.219362 IP 1.1.2.3.58879 > 5.6.7.8.80: Flags [P.], seq 3644276284:3644276400, ack 3106365518, win 92, options [nop,nop,TS val 938388 ecr 895069], length 116
17:38:03.230726 IP 5.6.7.8.80 > 1.1.2.3.58879: Flags [.], ack 3644276400, win 91, options [nop,nop,TS val 895072 ecr 938388], length 0
17:38:03.442585 IP 1.1.2.3.58880 > 5.6.7.8.80: Flags [S], seq 3049359077, win 5840, options [mss 1460,sackOK,TS val 938443 ecr 0,nop,wscale 6], length 0
17:38:03.453964 IP 5.6.7.8.80 > 1.1.2.3.58880: Flags [S.], seq 1443814796, ack 3049359078, win 5792, options [mss 1460,sackOK,TS val 895128 ecr 938443,nop,wscale 6], length 0
17:38:03.454001 IP 1.1.2.3.58880 > 5.6.7.8.80: Flags [.], ack 1443814797, win 92, options [nop,nop,TS val 938446 ecr 895128], length 0
17:38:03.454068 IP 1.1.2.3.58880 > 5.6.7.8.80: Flags [P.], seq 3049359078:3049359194, ack 1443814797, win 92, options [nop,nop,TS val 938446 ecr 895128], length 116
17:38:03.465445 IP 5.6.7.8.80 > 1.1.2.3.58880: Flags [.], ack 3049359194, win 91, options [nop,nop,TS val 895131 ecr 938446], length 0
17:38:03.468989 IP 5.6.7.8.80 > 1.1.2.3.58880: Flags [.], seq 1443814797:1443816245, ack 3049359194, win 91, options [nop,nop,TS val 895131 ecr 938446], length 1448
17:38:03.469001 IP 1.1.2.3.58880 > 5.6.7.8.80: Flags [.], ack 1443816245, win 137, options [nop,nop,TS val 938450 ecr 895131], length 0
17:38:03.469009 IP 5.6.7.8.80 > 1.1.2.3.58880: Flags [.], seq 1443816245:1443817693, ack 3049359194, win 91, options [nop,nop,TS val 895131 ecr 938446], length 1448
17:38:03.469016 IP 1.1.2.3.58880 > 5.6.7.8.80: Flags [.], ack 1443817693, win 182, options [nop,nop,TS val 938450 ecr 895131], length 0
17:38:03.469021 IP 5.6.7.8.80 > 1.1.2.3.58880: Flags [.], seq 1443817693:1443819141, ack 3049359194, win 91, options [nop,nop,TS val 895131 ecr 938446], length 1448
17:38:03.469029 IP 1.1.2.3.58880 > 5.6.7.8.80: Flags [.], ack 1443819141, win 227, options [nop,nop,TS val 938450 ecr 895131], length 0
17:38:03.480721 IP 5.6.7.8.80 > 1.1.2.3.58880: Flags [.], seq 1443819141:1443820589, ack 3049359194, win 91, options [nop,nop,TS val 895134 ecr 938450], length 1448
17:38:03.480738 IP 1.1.2.3.58880 > 5.6.7.8.80: Flags [.], ack 1443820589, win 273, options [nop,nop,TS val 938453 ecr 895134], length 0
17:38:03.480745 IP 5.6.7.8.80 > 1.1.2.3.58880: Flags [P.], seq 1443820589:1443822037, ack 3049359194, win 91, options [nop,nop,TS val 895134 ecr 938450], length 1448
17:38:03.480752 IP 1.1.2.3.58880 > 5.6.7.8.80: Flags [.], ack 1443822037, win 318, options [nop,nop,TS val 938453 ecr 895134], length 0
17:38:03.480756 IP 5.6.7.8.80 > 1.1.2.3.58880: Flags [.], seq 1443822037:1443823485, ack 3049359194, win 91, options [nop,nop,TS val 895134 ecr 938450], length 1448
17:38:03.480762 IP 1.1.2.3.58880 > 5.6.7.8.80: Flags [.], ack 1443823485, win 363, options [nop,nop,TS val 938453 ecr 895134], length 0
17:38:03.480767 IP 5.6.7.8.80 > 1.1.2.3.58880: Flags [P.], seq 1443823485:1443824445, ack 3049359194, win 91, options [nop,nop,TS val 895134 ecr 938450], length 960
17:38:03.480773 IP 1.1.2.3.58880 > 5.6.7.8.80: Flags [.], ack 1443824445, win 408, options [nop,nop,TS val 938453 ecr 895134], length 0
17:38:03.481262 IP 1.1.2.3.58880 > 5.6.7.8.80: Flags [F.], seq 3049359194, ack 1443824445, win 408, options [nop,nop,TS val 938453 ecr 895134], length 0
17:38:03.492700 IP 5.6.7.8.80 > 1.1.2.3.58880: Flags [F.], seq 1443824445, ack 3049359195, win 91, options [nop,nop,TS val 895137 ecr 938453], length 0
17:38:03.492729 IP 1.1.2.3.58880 > 5.6.7.8.80: Flags [.], ack 1443824446, win 408, options [nop,nop,TS val 938456 ecr 895137], length 0
17:38:03.707956 IP 1.1.2.3.58881 > 5.6.7.8.80: Flags [S], seq 1883764128, win 5840, options [mss 1460,sackOK,TS val 938510 ecr 0,nop,wscale 6], length 0
17:38:03.719581 IP 5.6.7.8.80 > 1.1.2.3.58881: Flags [S.], seq 4060655502, ack 1883764129, win 5792, options [mss 1460,sackOK,TS val 895194 ecr 938510,nop,wscale 6], length 0
17:38:03.719618 IP 1.1.2.3.58881 > 5.6.7.8.80: Flags [.], ack 4060655503, win 92, options [nop,nop,TS val 938513 ecr 895194], length 0
17:38:03.719698 IP 1.1.2.3.58881 > 5.6.7.8.80: Flags [P.], seq 1883764129:1883764245, ack 4060655503, win 92, options [nop,nop,TS val 938513 ecr 895194], length 116
17:38:03.731077 IP 5.6.7.8.80 > 1.1.2.3.58881: Flags [.], ack 1883764245, win 91, options [nop,nop,TS val 895197 ecr 938513], length 0
17:38:03.733477 IP 1.1.2.3.58882 > 5.6.7.8.80: Flags [S], seq 1364043049, win 5840, options [mss 1460,sackOK,TS val 938516 ecr 0,nop,wscale 6], length 0
17:38:03.734206 IP 5.6.7.8.80 > 1.1.2.3.58881: Flags [.], seq 4060655503:4060656951, ack 1883764245, win 91, options [nop,nop,TS val 895198 ecr 938513], length 1448
17:38:03.734229 IP 1.1.2.3.58881 > 5.6.7.8.80: Flags [.], ack 4060656951, win 137, options [nop,nop,TS val 938516 ecr 895198], length 0
17:38:03.734240 IP 5.6.7.8.80 > 1.1.2.3.58881: Flags [.], seq 4060656951:4060658399, ack 1883764245, win 91, options [nop,nop,TS val 895198 ecr 938513], length 1448
17:38:03.734258 IP 1.1.2.3.58881 > 5.6.7.8.80: Flags [.], ack 4060658399, win 182, options [nop,nop,TS val 938516 ecr 895198], length 0
17:38:03.734265 IP 5.6.7.8.80 > 1.1.2.3.58881: Flags [.], seq 4060658399:4060659847, ack 1883764245, win 91, options [nop,nop,TS val 895198 ecr 938513], length 1448
17:38:03.734279 IP 1.1.2.3.58881 > 5.6.7.8.80: Flags [.], ack 4060659847, win 227, options [nop,nop,TS val 938516 ecr 895198], length 0
17:38:03.744942 IP 5.6.7.8.80 > 1.1.2.3.58882: Flags [S.], seq 3288998617, ack 1364043050, win 5792, options [mss 1460,sackOK,TS val 895200 ecr 938516,nop,wscale 6], length 0
17:38:03.744981 IP 1.1.2.3.58882 > 5.6.7.8.80: Flags [.], ack 3288998618, win 92, options [nop,nop,TS val 938519 ecr 895200], length 0
17:38:03.745065 IP 1.1.2.3.58882 > 5.6.7.8.80: Flags [P.], seq 1364043050:1364043166, ack 3288998618, win 92, options [nop,nop,TS val 938519 ecr 895200], length 116
17:38:03.745836 IP 5.6.7.8.80 > 1.1.2.3.58881: Flags [.], seq 4060659847:4060661295, ack 1883764245, win 91, options [nop,nop,TS val 895201 ecr 938516], length 1448
17:38:03.745852 IP 1.1.2.3.58881 > 5.6.7.8.80: Flags [.], ack 4060661295, win 273, options [nop,nop,TS val 938519 ecr 895201], length 0
17:38:03.745861 IP 5.6.7.8.80 > 1.1.2.3.58881: Flags [P.], seq 4060661295:4060661871, ack 1883764245, win 91, options [nop,nop,TS val 895201 ecr 938516], length 576
17:38:03.745878 IP 1.1.2.3.58881 > 5.6.7.8.80: Flags [.], ack 4060661871, win 318, options [nop,nop,TS val 938519 ecr 895201], length 0
17:38:03.746305 IP 1.1.2.3.58881 > 5.6.7.8.80: Flags [F.], seq 1883764245, ack 4060661871, win 318, options [nop,nop,TS val 938519 ecr 895201], length 0
17:38:03.756521 IP 5.6.7.8.80 > 1.1.2.3.58882: Flags [.], ack 1364043166, win 91, options [nop,nop,TS val 895203 ecr 938519], length 0
17:38:03.757667 IP 5.6.7.8.80 > 1.1.2.3.58881: Flags [F.], seq 4060661871, ack 1883764246, win 91, options [nop,nop,TS val 895204 ecr 938519], length 0
17:38:03.757684 IP 1.1.2.3.58881 > 5.6.7.8.80: Flags [.], ack 4060661872, win 318, options [nop,nop,TS val 938522 ecr 895204], length 0
17:38:03.759714 IP 5.6.7.8.80 > 1.1.2.3.58882: Flags [.], seq 3288998618:3289000066, ack 1364043166, win 91, options [nop,nop,TS val 895204 ecr 938519], length 1448
17:38:03.759725 IP 1.1.2.3.58882 > 5.6.7.8.80: Flags [.], ack 3289000066, win 137, options [nop,nop,TS val 938523 ecr 895204], length 0
17:38:03.759734 IP 5.6.7.8.80 > 1.1.2.3.58882: Flags [.], seq 3289000066:3289001514, ack 1364043166, win 91, options [nop,nop,TS val 895204 ecr 938519], length 1448
17:38:03.759745 IP 1.1.2.3.58882 > 5.6.7.8.80: Flags [.], ack 3289001514, win 182, options [nop,nop,TS val 938523 ecr 895204], length 0
17:38:03.759752 IP 5.6.7.8.80 > 1.1.2.3.58882: Flags [.], seq 3289001514:3289002962, ack 1364043166, win 91, options [nop,nop,TS val 895204 ecr 938519], length 1448
17:38:03.759763 IP 1.1.2.3.58882 > 5.6.7.8.80: Flags [.], ack 3289002962, win 227, options [nop,nop,TS val 938523 ecr 895204], length 0
17:38:03.771447 IP 5.6.7.8.80 > 1.1.2.3.58882: Flags [.], seq 3289002962:3289004410, ack 1364043166, win 91, options [nop,nop,TS val 895207 ecr 938523], length 1448
17:38:03.771468 IP 1.1.2.3.58882 > 5.6.7.8.80: Flags [.], ack 3289004410, win 273, options [nop,nop,TS val 938526 ecr 895207], length 0
17:38:03.771477 IP 5.6.7.8.80 > 1.1.2.3.58882: Flags [P.], seq 3289004410:3289004655, ack 1364043166, win 91, options [nop,nop,TS val 895207 ecr 938523], length 245
17:38:03.771487 IP 1.1.2.3.58882 > 5.6.7.8.80: Flags [.], ack 3289004655, win 318, options [nop,nop,TS val 938526 ecr 895207], length 0
17:38:03.771924 IP 1.1.2.3.58882 > 5.6.7.8.80: Flags [F.], seq 1364043166, ack 3289004655, win 318, options [nop,nop,TS val 938526 ecr 895207], length 0
17:38:03.783530 IP 5.6.7.8.80 > 1.1.2.3.58882: Flags [F.], seq 3289004655, ack 1364043167, win 91, options [nop,nop,TS val 895210 ecr 938526], length 0
17:38:03.783560 IP 1.1.2.3.58882 > 5.6.7.8.80: Flags [.], ack 3289004656, win 318, options [nop,nop,TS val 938529 ecr 895210], length 0
17:38:03.819167 IP 5.6.7.8.80 > 1.1.2.3.58879: Flags [.], seq 3106365518:3106366966, ack 3644276400, win 91, options [nop,nop,TS val 895219 ecr 938388], length 1448
17:38:03.819184 IP 1.1.2.3.58879 > 5.6.7.8.80: Flags [.], ack 3106366966, win 137, options [nop,nop,TS val 938538 ecr 895219], length 0
17:38:03.819189 IP 5.6.7.8.80 > 1.1.2.3.58879: Flags [.], seq 3106366966:3106368414, ack 3644276400, win 91, options [nop,nop,TS val 895219 ecr 938388], length 1448
17:38:03.819196 IP 1.1.2.3.58879 > 5.6.7.8.80: Flags [.], ack 3106368414, win 182, options [nop,nop,TS val 938538 ecr 895219], length 0
17:38:03.819201 IP 5.6.7.8.80 > 1.1.2.3.58879: Flags [.], seq 3106368414:3106369862, ack 3644276400, win 91, options [nop,nop,TS val 895219 ecr 938388], length 1448
17:38:03.819208 IP 1.1.2.3.58879 > 5.6.7.8.80: Flags [.], ack 3106369862, win 227, options [nop,nop,TS val 938538 ecr 895219], length 0
17:38:03.830799 IP 5.6.7.8.80 > 1.1.2.3.58879: Flags [.], seq 3106369862:3106371310, ack 3644276400, win 91, options [nop,nop,TS val 895222 ecr 938538], length 1448
17:38:03.830818 IP 1.1.2.3.58879 > 5.6.7.8.80: Flags [.], ack 3106371310, win 273, options [nop,nop,TS val 938541 ecr 895222], length 0
17:38:03.830897 IP 5.6.7.8.80 > 1.1.2.3.58879: Flags [P.], seq 3106371310:3106372758, ack 3644276400, win 91, options [nop,nop,TS val 895222 ecr 938538], length 1448
17:38:03.830907 IP 1.1.2.3.58879 > 5.6.7.8.80: Flags [.], ack 3106372758, win 318, options [nop,nop,TS val 938541 ecr 895222], length 0
17:38:03.830913 IP 5.6.7.8.80 > 1.1.2.3.58879: Flags [.], seq 3106372758:3106374206, ack 3644276400, win 91, options [nop,nop,TS val 895222 ecr 938538], length 1448
17:38:03.830919 IP 1.1.2.3.58879 > 5.6.7.8.80: Flags [.], ack 3106374206, win 363, options [nop,nop,TS val 938541 ecr 895222], length 0
17:38:03.831047 IP 5.6.7.8.80 > 1.1.2.3.58879: Flags [P.], seq 3106374206:3106375460, ack 3644276400, win 91, options [nop,nop,TS val 895222 ecr 938538], length 1254
17:38:03.831057 IP 1.1.2.3.58879 > 5.6.7.8.80: Flags [.], ack 3106375460, win 408, options [nop,nop,TS val 938541 ecr 895222], length 0
17:38:03.831459 IP 1.1.2.3.58879 > 5.6.7.8.80: Flags [F.], seq 3644276400, ack 3106375460, win 408, options [nop,nop,TS val 938541 ecr 895222], length 0
17:38:03.842979 IP 5.6.7.8.80 > 1.1.2.3.58879: Flags [F.], seq 3106375460, ack 3644276401, win 91, options [nop,nop,TS val 895225 ecr 938541], length 0
17:38:03.843007 IP 1.1.2.3.58879 > 5.6.7.8.80: Flags [.], ack 3106375461, win 408, options [nop,nop,TS val 938543 ecr 895225], length 0
17:38:03.928534 IP 1.1.2.3.58883 > 5.6.7.8.80: Flags [S], seq 2003423055, win 5840, options [mss 1460,sackOK,TS val 938565 ecr 0,nop,wscale 6], length 0
17:38:03.939922 IP 5.6.7.8.80 > 1.1.2.3.58883: Flags [S.], seq 8391580, ack 2003423056, win 5792, options [mss 1460,sackOK,TS val 895249 ecr 938565,nop,wscale 6], length 0
17:38:03.939958 IP 1.1.2.3.58883 > 5.6.7.8.80: Flags [.], ack 8391581, win 92, options [nop,nop,TS val 938568 ecr 895249], length 0
17:38:03.940035 IP 1.1.2.3.58883 > 5.6.7.8.80: Flags [P.], seq 2003423056:2003423172, ack 8391581, win 92, options [nop,nop,TS val 938568 ecr 895249], length 116
17:38:03.951551 IP 5.6.7.8.80 > 1.1.2.3.58883: Flags [.], ack 2003423172, win 91, options [nop,nop,TS val 895252 ecr 938568], length 0
17:38:03.954697 IP 5.6.7.8.80 > 1.1.2.3.58883: Flags [.], seq 8391581:8393029, ack 2003423172, win 91, options [nop,nop,TS val 895253 ecr 938568], length 1448
17:38:03.954709 IP 1.1.2.3.58883 > 5.6.7.8.80: Flags [.], ack 8393029, win 137, options [nop,nop,TS val 938572 ecr 895253], length 0
17:38:03.954716 IP 5.6.7.8.80 > 1.1.2.3.58883: Flags [.], seq 8393029:8394477, ack 2003423172, win 91, options [nop,nop,TS val 895253 ecr 938568], length 1448
17:38:03.954723 IP 1.1.2.3.58883 > 5.6.7.8.80: Flags [.], ack 8394477, win 182, options [nop,nop,TS val 938572 ecr 895253], length 0
17:38:03.954728 IP 5.6.7.8.80 > 1.1.2.3.58883: Flags [.], seq 8394477:8395925, ack 2003423172, win 91, options [nop,nop,TS val 895253 ecr 938568], length 1448
17:38:03.954736 IP 1.1.2.3.58883 > 5.6.7.8.80: Flags [.], ack 8395925, win 227, options [nop,nop,TS val 938572 ecr 895253], length 0
17:38:03.966478 IP 5.6.7.8.80 > 1.1.2.3.58883: Flags [.], seq 8395925:8397373, ack 2003423172, win 91, options [nop,nop,TS val 895256 ecr 938572], length 1448
17:38:03.966495 IP 1.1.2.3.58883 > 5.6.7.8.80: Flags [.], ack 8397373, win 273, options [nop,nop,TS val 938575 ecr 895256], length 0
17:38:03.966501 IP 5.6.7.8.80 > 1.1.2.3.58883: Flags [P.], seq 8397373:8398821, ack 2003423172, win 91, options [nop,nop,TS val 895256 ecr 938572], length 1448
17:38:03.966508 IP 1.1.2.3.58883 > 5.6.7.8.80: Flags [.], ack 8398821, win 318, options [nop,nop,TS val 938575 ecr 895256], length 0
17:38:03.966512 IP 5.6.7.8.80 > 1.1.2.3.58883: Flags [.], seq 8398821:8400269, ack 2003423172, win 91, options [nop,nop,TS val 895256 ecr 938572], length 1448
17:38:03.966518 IP 1.1.2.3.58883 > 5.6.7.8.80: Flags [.], ack 8400269, win 363, options [nop,nop,TS val 938575 ecr 895256], length 0
17:38:03.966523 IP 5.6.7.8.80 > 1.1.2.3.58883: Flags [P.], seq 8400269:8401276, ack 2003423172, win 91, options [nop,nop,TS val 895256 ecr 938572], length 1007
17:38:03.966530 IP 1.1.2.3.58883 > 5.6.7.8.80: Flags [.], ack 8401276, win 408, options [nop,nop,TS val 938575 ecr 895256], length 0
17:38:03.967036 IP 1.1.2.3.58883 > 5.6.7.8.80: Flags [F.], seq 2003423172, ack 8401276, win 408, options [nop,nop,TS val 938575 ecr 895256], length 0
17:38:03.978557 IP 5.6.7.8.80 > 1.1.2.3.58883: Flags [F.], seq 8401276, ack 2003423173, win 91, options [nop,nop,TS val 895259 ecr 938575], length 0
17:38:03.978585 IP 1.1.2.3.58883 > 5.6.7.8.80: Flags [.], ack 8401277, win 408, options [nop,nop,TS val 938577 ecr 895259], length 0
17:38:03.995607 IP 1.1.2.3.58884 > 5.6.7.8.80: Flags [S], seq 3576343076, win 5840, options [mss 1460,sackOK,TS val 938582 ecr 0,nop,wscale 6], length 0
17:38:04.007031 IP 5.6.7.8.80 > 1.1.2.3.58884: Flags [S.], seq 727027754, ack 3576343077, win 5792, options [mss 1460,sackOK,TS val 895266 ecr 938582,nop,wscale 6], length 0
17:38:04.007093 IP 1.1.2.3.58884 > 5.6.7.8.80: Flags [.], ack 727027755, win 92, options [nop,nop,TS val 938585 ecr 895266], length 0
17:38:04.007333 IP 1.1.2.3.58884 > 5.6.7.8.80: Flags [P.], seq 3576343077:3576343193, ack 727027755, win 92, options [nop,nop,TS val 938585 ecr 895266], length 116
17:38:04.018752 IP 5.6.7.8.80 > 1.1.2.3.58884: Flags [.], ack 3576343193, win 91, options [nop,nop,TS val 895269 ecr 938585], length 0
17:38:04.021287 IP 5.6.7.8.80 > 1.1.2.3.58884: Flags [.], seq 727027755:727029203, ack 3576343193, win 91, options [nop,nop,TS val 895269 ecr 938585], length 1448
17:38:04.021305 IP 1.1.2.3.58884 > 5.6.7.8.80: Flags [.], ack 727029203, win 137, options [nop,nop,TS val 938588 ecr 895269], length 0
17:38:04.021314 IP 5.6.7.8.80 > 1.1.2.3.58884: Flags [P.], seq 727029203:727030446, ack 3576343193, win 91, options [nop,nop,TS val 895269 ecr 938585], length 1243
17:38:04.021321 IP 1.1.2.3.58884 > 5.6.7.8.80: Flags [.], ack 727030446, win 182, options [nop,nop,TS val 938588 ecr 895269], length 0
17:38:04.021921 IP 1.1.2.3.58884 > 5.6.7.8.80: Flags [F.], seq 3576343193, ack 727030446, win 182, options [nop,nop,TS val 938588 ecr 895269], length 0
17:38:04.033520 IP 5.6.7.8.80 > 1.1.2.3.58884: Flags [F.], seq 727030446, ack 3576343194, win 91, options [nop,nop,TS val 895272 ecr 938588], length 0
17:38:04.033548 IP 1.1.2.3.58884 > 5.6.7.8.80: Flags [.], ack 727030447, win 182, options [nop,nop,TS val 938591 ecr 895272], length 0
17:38:04.260134 IP 1.1.2.3.58885 > 5.6.7.8.80: Flags [S], seq 2902138989, win 5840, options [mss 1460,sackOK,TS val 938648 ecr 0,nop,wscale 6], length 0
17:38:04.271981 IP 5.6.7.8.80 > 1.1.2.3.58885: Flags [S.], seq 1881282894, ack 2902138990, win 5792, options [mss 1460,sackOK,TS val 895332 ecr 938648,nop,wscale 6], length 0
17:38:04.272016 IP 1.1.2.3.58885 > 5.6.7.8.80: Flags [.], ack 1881282895, win 92, options [nop,nop,TS val 938651 ecr 895332], length 0
17:38:04.272078 IP 1.1.2.3.58885 > 5.6.7.8.80: Flags [P.], seq 2902138990:2902139106, ack 1881282895, win 92, options [nop,nop,TS val 938651 ecr 895332], length 116
17:38:04.283610 IP 5.6.7.8.80 > 1.1.2.3.58885: Flags [.], ack 2902139106, win 91, options [nop,nop,TS val 895335 ecr 938651], length 0
17:38:04.285755 IP 5.6.7.8.80 > 1.1.2.3.58885: Flags [.], seq 1881282895:1881284343, ack 2902139106, win 91, options [nop,nop,TS val 895336 ecr 938651], length 1448
17:38:04.285767 IP 1.1.2.3.58885 > 5.6.7.8.80: Flags [.], ack 1881284343, win 137, options [nop,nop,TS val 938654 ecr 895336], length 0
17:38:04.285778 IP 5.6.7.8.80 > 1.1.2.3.58885: Flags [P.], seq 1881284343:1881284390, ack 2902139106, win 91, options [nop,nop,TS val 895336 ecr 938651], length 47
17:38:04.285789 IP 1.1.2.3.58885 > 5.6.7.8.80: Flags [.], ack 1881284390, win 137, options [nop,nop,TS val 938654 ecr 895336], length 0
17:38:04.286283 IP 1.1.2.3.58885 > 5.6.7.8.80: Flags [F.], seq 2902139106, ack 1881284390, win 137, options [nop,nop,TS val 938654 ecr 895336], length 0
17:38:04.297739 IP 5.6.7.8.80 > 1.1.2.3.58885: Flags [F.], seq 1881284390, ack 2902139107, win 91, options [nop,nop,TS val 895339 ecr 938654], length 0
17:38:04.297769 IP 1.1.2.3.58885 > 5.6.7.8.80: Flags [.], ack 1881284391, win 137, options [nop,nop,TS val 938657 ecr 895339], length 0
17:38:05.087199 IP 1.1.2.3.58886 > 5.6.7.8.80: Flags [S], seq 2613036910, win 5840, options [mss 1460,sackOK,TS val 938855 ecr 0,nop,wscale 6], length 0
17:38:05.098649 IP 5.6.7.8.80 > 1.1.2.3.58886: Flags [S.], seq 1968830562, ack 2613036911, win 5792, options [mss 1460,sackOK,TS val 895539 ecr 938855,nop,wscale 6], length 0
17:38:05.098748 IP 1.1.2.3.58886 > 5.6.7.8.80: Flags [.], ack 1968830563, win 92, options [nop,nop,TS val 938857 ecr 895539], length 0
17:38:05.098964 IP 1.1.2.3.58886 > 5.6.7.8.80: Flags [P.], seq 2613036911:2613037027, ack 1968830563, win 92, options [nop,nop,TS val 938857 ecr 895539], length 116
17:38:05.101085 IP 1.1.2.3.58887 > 5.6.7.8.80: Flags [S], seq 1484745146, win 5840, options [mss 1460,sackOK,TS val 938858 ecr 0,nop,wscale 6], length 0
17:38:05.110363 IP 5.6.7.8.80 > 1.1.2.3.58886: Flags [.], ack 2613037027, win 91, options [nop,nop,TS val 895542 ecr 938857], length 0
17:38:05.112507 IP 5.6.7.8.80 > 1.1.2.3.58887: Flags [S.], seq 1658633991, ack 1484745147, win 5792, options [mss 1460,sackOK,TS val 895542 ecr 938858,nop,wscale 6], length 0
17:38:05.112531 IP 1.1.2.3.58887 > 5.6.7.8.80: Flags [.], ack 1658633992, win 92, options [nop,nop,TS val 938861 ecr 895542], length 0
17:38:05.112594 IP 1.1.2.3.58887 > 5.6.7.8.80: Flags [P.], seq 1484745147:1484745263, ack 1658633992, win 92, options [nop,nop,TS val 938861 ecr 895542], length 116
17:38:05.112906 IP 5.6.7.8.80 > 1.1.2.3.58886: Flags [.], seq 1968830563:1968832011, ack 2613037027, win 91, options [nop,nop,TS val 895542 ecr 938857], length 1448
17:38:05.112920 IP 1.1.2.3.58886 > 5.6.7.8.80: Flags [.], ack 1968832011, win 137, options [nop,nop,TS val 938861 ecr 895542], length 0
17:38:05.112926 IP 5.6.7.8.80 > 1.1.2.3.58886: Flags [.], seq 1968832011:1968833459, ack 2613037027, win 91, options [nop,nop,TS val 895542 ecr 938857], length 1448
17:38:05.112933 IP 1.1.2.3.58886 > 5.6.7.8.80: Flags [.], ack 1968833459, win 182, options [nop,nop,TS val 938861 ecr 895542], length 0
17:38:05.112938 IP 5.6.7.8.80 > 1.1.2.3.58886: Flags [P.], seq 1968833459:1968833541, ack 2613037027, win 91, options [nop,nop,TS val 895542 ecr 938857], length 82
17:38:05.112944 IP 1.1.2.3.58886 > 5.6.7.8.80: Flags [.], ack 1968833541, win 182, options [nop,nop,TS val 938861 ecr 895542], length 0
17:38:05.113521 IP 1.1.2.3.58886 > 5.6.7.8.80: Flags [F.], seq 2613037027, ack 1968833541, win 182, options [nop,nop,TS val 938861 ecr 895542], length 0
17:38:05.123990 IP 5.6.7.8.80 > 1.1.2.3.58887: Flags [.], ack 1484745263, win 91, options [nop,nop,TS val 895545 ecr 938861], length 0
17:38:05.124987 IP 5.6.7.8.80 > 1.1.2.3.58886: Flags [F.], seq 1968833541, ack 2613037028, win 91, options [nop,nop,TS val 895545 ecr 938861], length 0
17:38:05.125003 IP 1.1.2.3.58886 > 5.6.7.8.80: Flags [.], ack 1968833542, win 182, options [nop,nop,TS val 938864 ecr 895545], length 0
17:38:05.126783 IP 5.6.7.8.80 > 1.1.2.3.58887: Flags [.], seq 1658633992:1658635440, ack 1484745263, win 91, options [nop,nop,TS val 895546 ecr 938861], length 1448
17:38:05.126793 IP 1.1.2.3.58887 > 5.6.7.8.80: Flags [.], ack 1658635440, win 137, options [nop,nop,TS val 938864 ecr 895546], length 0
17:38:05.126801 IP 5.6.7.8.80 > 1.1.2.3.58887: Flags [.], seq 1658635440:1658636888, ack 1484745263, win 91, options [nop,nop,TS val 895546 ecr 938861], length 1448
17:38:05.126807 IP 1.1.2.3.58887 > 5.6.7.8.80: Flags [.], ack 1658636888, win 182, options [nop,nop,TS val 938864 ecr 895546], length 0
17:38:05.126812 IP 5.6.7.8.80 > 1.1.2.3.58887: Flags [.], seq 1658636888:1658638336, ack 1484745263, win 91, options [nop,nop,TS val 895546 ecr 938861], length 1448
17:38:05.126821 IP 1.1.2.3.58887 > 5.6.7.8.80: Flags [.], ack 1658638336, win 227, options [nop,nop,TS val 938864 ecr 895546], length 0
17:38:05.138415 IP 5.6.7.8.80 > 1.1.2.3.58887: Flags [.], seq 1658638336:1658639784, ack 1484745263, win 91, options [nop,nop,TS val 895549 ecr 938864], length 1448
17:38:05.138436 IP 1.1.2.3.58887 > 5.6.7.8.80: Flags [.], ack 1658639784, win 273, options [nop,nop,TS val 938868 ecr 895549], length 0
17:38:05.138443 IP 5.6.7.8.80 > 1.1.2.3.58887: Flags [P.], seq 1658639784:1658641232, ack 1484745263, win 91, options [nop,nop,TS val 895549 ecr 938864], length 1448
17:38:05.138449 IP 1.1.2.3.58887 > 5.6.7.8.80: Flags [.], ack 1658641232, win 318, options [nop,nop,TS val 938868 ecr 895549], length 0
17:38:05.138514 IP 5.6.7.8.80 > 1.1.2.3.58887: Flags [.], seq 1658641232:1658642680, ack 1484745263, win 91, options [nop,nop,TS val 895549 ecr 938864], length 1448
17:38:05.138521 IP 1.1.2.3.58887 > 5.6.7.8.80: Flags [.], ack 1658642680, win 363, options [nop,nop,TS val 938868 ecr 895549], length 0
17:38:05.138525 IP 5.6.7.8.80 > 1.1.2.3.58887: Flags [P.], seq 1658642680:1658642981, ack 1484745263, win 91, options [nop,nop,TS val 895549 ecr 938864], length 301
17:38:05.138531 IP 1.1.2.3.58887 > 5.6.7.8.80: Flags [.], ack 1658642981, win 408, options [nop,nop,TS val 938868 ecr 895549], length 0
17:38:05.139006 IP 1.1.2.3.58887 > 5.6.7.8.80: Flags [F.], seq 1484745263, ack 1658642981, win 408, options [nop,nop,TS val 938868 ecr 895549], length 0
17:38:05.150596 IP 5.6.7.8.80 > 1.1.2.3.58887: Flags [F.], seq 1658642981, ack 1484745264, win 91, options [nop,nop,TS val 895552 ecr 938868], length 0
17:38:05.150627 IP 1.1.2.3.58887 > 5.6.7.8.80: Flags [.], ack 1658642982, win 408, options [nop,nop,TS val 938870 ecr 895552], length 0
17:38:05.232775 IP 1.1.2.3.58888 > 5.6.7.8.80: Flags [S], seq 3545997640, win 5840, options [mss 1460,sackOK,TS val 938891 ecr 0,nop,wscale 6], length 0
17:38:05.244294 IP 5.6.7.8.80 > 1.1.2.3.58888: Flags [S.], seq 3567120607, ack 3545997641, win 5792, options [mss 1460,sackOK,TS val 895575 ecr 938891,nop,wscale 6], length 0
17:38:05.244329 IP 1.1.2.3.58888 > 5.6.7.8.80: Flags [.], ack 3567120608, win 92, options [nop,nop,TS val 938894 ecr 895575], length 0
17:38:05.244402 IP 1.1.2.3.58888 > 5.6.7.8.80: Flags [P.], seq 3545997641:3545997757, ack 3567120608, win 92, options [nop,nop,TS val 938894 ecr 895575], length 116
17:38:05.255824 IP 5.6.7.8.80 > 1.1.2.3.58888: Flags [.], ack 3545997757, win 91, options [nop,nop,TS val 895578 ecr 938894], length 0
17:38:05.258470 IP 5.6.7.8.80 > 1.1.2.3.58888: Flags [.], seq 3567120608:3567122056, ack 3545997757, win 91, options [nop,nop,TS val 895579 ecr 938894], length 1448
17:38:05.258482 IP 1.1.2.3.58888 > 5.6.7.8.80: Flags [.], ack 3567122056, win 137, options [nop,nop,TS val 938898 ecr 895579], length 0
17:38:05.258490 IP 5.6.7.8.80 > 1.1.2.3.58888: Flags [.], seq 3567122056:3567123504, ack 3545997757, win 91, options [nop,nop,TS val 895579 ecr 938894], length 1448
17:38:05.258497 IP 1.1.2.3.58888 > 5.6.7.8.80: Flags [.], ack 3567123504, win 182, options [nop,nop,TS val 938898 ecr 895579], length 0
17:38:05.258501 IP 5.6.7.8.80 > 1.1.2.3.58888: Flags [.], seq 3567123504:3567124952, ack 3545997757, win 91, options [nop,nop,TS val 895579 ecr 938894], length 1448
17:38:05.258510 IP 1.1.2.3.58888 > 5.6.7.8.80: Flags [.], ack 3567124952, win 227, options [nop,nop,TS val 938898 ecr 895579], length 0
17:38:05.270052 IP 5.6.7.8.80 > 1.1.2.3.58888: Flags [.], seq 3567124952:3567126400, ack 3545997757, win 91, options [nop,nop,TS val 895582 ecr 938898], length 1448
17:38:05.270071 IP 1.1.2.3.58888 > 5.6.7.8.80: Flags [.], ack 3567126400, win 273, options [nop,nop,TS val 938900 ecr 895582], length 0
17:38:05.270078 IP 5.6.7.8.80 > 1.1.2.3.58888: Flags [P.], seq 3567126400:3567127129, ack 3545997757, win 91, options [nop,nop,TS val 895582 ecr 938898], length 729
17:38:05.270085 IP 1.1.2.3.58888 > 5.6.7.8.80: Flags [.], ack 3567127129, win 318, options [nop,nop,TS val 938900 ecr 895582], length 0
17:38:05.270546 IP 1.1.2.3.58888 > 5.6.7.8.80: Flags [F.], seq 3545997757, ack 3567127129, win 318, options [nop,nop,TS val 938900 ecr 895582], length 0
17:38:05.282032 IP 5.6.7.8.80 > 1.1.2.3.58888: Flags [F.], seq 3567127129, ack 3545997758, win 91, options [nop,nop,TS val 895585 ecr 938900], length 0
17:38:05.282060 IP 1.1.2.3.58888 > 5.6.7.8.80: Flags [.], ack 3567127130, win 318, options [nop,nop,TS val 938903 ecr 895585], length 0
17:38:05.514431 IP 1.1.2.3.58889 > 5.6.7.8.80: Flags [S], seq 2880401087, win 5840, options [mss 1460,sackOK,TS val 938961 ecr 0,nop,wscale 6], length 0
17:38:05.525884 IP 5.6.7.8.80 > 1.1.2.3.58889: Flags [S.], seq 3395840320, ack 2880401088, win 5792, options [mss 1460,sackOK,TS val 895646 ecr 938961,nop,wscale 6], length 0
17:38:05.525920 IP 1.1.2.3.58889 > 5.6.7.8.80: Flags [.], ack 3395840321, win 92, options [nop,nop,TS val 938964 ecr 895646], length 0
17:38:05.525981 IP 1.1.2.3.58889 > 5.6.7.8.80: Flags [P.], seq 2880401088:2880401204, ack 3395840321, win 92, options [nop,nop,TS val 938964 ecr 895646], length 116
17:38:05.537365 IP 5.6.7.8.80 > 1.1.2.3.58889: Flags [.], ack 2880401204, win 91, options [nop,nop,TS val 895649 ecr 938964], length 0
17:38:05.539660 IP 5.6.7.8.80 > 1.1.2.3.58889: Flags [.], seq 3395840321:3395841769, ack 2880401204, win 91, options [nop,nop,TS val 895649 ecr 938964], length 1448
17:38:05.539676 IP 1.1.2.3.58889 > 5.6.7.8.80: Flags [.], ack 3395841769, win 137, options [nop,nop,TS val 938968 ecr 895649], length 0
17:38:05.539685 IP 5.6.7.8.80 > 1.1.2.3.58889: Flags [P.], seq 3395841769:3395842105, ack 2880401204, win 91, options [nop,nop,TS val 895649 ecr 938964], length 336
17:38:05.539692 IP 1.1.2.3.58889 > 5.6.7.8.80: Flags [.], ack 3395842105, win 182, options [nop,nop,TS val 938968 ecr 895649], length 0
17:38:05.540238 IP 1.1.2.3.58889 > 5.6.7.8.80: Flags [F.], seq 2880401204, ack 3395842105, win 182, options [nop,nop,TS val 938968 ecr 895649], length 0
17:38:05.551642 IP 5.6.7.8.80 > 1.1.2.3.58889: Flags [F.], seq 3395842105, ack 2880401205, win 91, options [nop,nop,TS val 895652 ecr 938968], length 0
17:38:05.551671 IP 1.1.2.3.58889 > 5.6.7.8.80: Flags [.], ack 3395842106, win 182, options [nop,nop,TS val 938971 ecr 895652], length 0
17:38:05.583655 IP 1.1.2.3.58890 > 5.6.7.8.80: Flags [S], seq 3974634326, win 5840, options [mss 1460,sackOK,TS val 938979 ecr 0,nop,wscale 6], length 0
17:38:05.595122 IP 5.6.7.8.80 > 1.1.2.3.58890: Flags [S.], seq 174402798, ack 3974634327, win 5792, options [mss 1460,sackOK,TS val 895663 ecr 938979,nop,wscale 6], length 0
17:38:05.595157 IP 1.1.2.3.58890 > 5.6.7.8.80: Flags [.], ack 174402799, win 92, options [nop,nop,TS val 938982 ecr 895663], length 0
17:38:05.595226 IP 1.1.2.3.58890 > 5.6.7.8.80: Flags [P.], seq 3974634327:3974634443, ack 174402799, win 92, options [nop,nop,TS val 938982 ecr 895663], length 116
17:38:05.606701 IP 5.6.7.8.80 > 1.1.2.3.58890: Flags [.], ack 3974634443, win 91, options [nop,nop,TS val 895666 ecr 938982], length 0
17:38:05.609147 IP 5.6.7.8.80 > 1.1.2.3.58890: Flags [.], seq 174402799:174404247, ack 3974634443, win 91, options [nop,nop,TS val 895667 ecr 938982], length 1448
17:38:05.609158 IP 1.1.2.3.58890 > 5.6.7.8.80: Flags [.], ack 174404247, win 137, options [nop,nop,TS val 938985 ecr 895667], length 0
17:38:05.609169 IP 5.6.7.8.80 > 1.1.2.3.58890: Flags [.], seq 174404247:174405695, ack 3974634443, win 91, options [nop,nop,TS val 895667 ecr 938982], length 1448
17:38:05.609180 IP 1.1.2.3.58890 > 5.6.7.8.80: Flags [.], ack 174405695, win 182, options [nop,nop,TS val 938985 ecr 895667], length 0
17:38:05.609186 IP 5.6.7.8.80 > 1.1.2.3.58890: Flags [P.], seq 174405695:174406709, ack 3974634443, win 91, options [nop,nop,TS val 895667 ecr 938982], length 1014
17:38:05.609205 IP 1.1.2.3.58890 > 5.6.7.8.80: Flags [.], ack 174406709, win 227, options [nop,nop,TS val 938985 ecr 895667], length 0
17:38:05.609710 IP 1.1.2.3.58890 > 5.6.7.8.80: Flags [F.], seq 3974634443, ack 174406709, win 227, options [nop,nop,TS val 938985 ecr 895667], length 0
17:38:05.621229 IP 5.6.7.8.80 > 1.1.2.3.58890: Flags [F.], seq 174406709, ack 3974634444, win 91, options [nop,nop,TS val 895670 ecr 938985], length 0
17:38:05.621259 IP 1.1.2.3.58890 > 5.6.7.8.80: Flags [.], ack 174406710, win 227, options [nop,nop,TS val 938988 ecr 895670], length 0
17:38:05.766179 IP 1.1.2.3.58891 > 5.6.7.8.80: Flags [S], seq 1722990083, win 5840, options [mss 1460,sackOK,TS val 939024 ecr 0,nop,wscale 6], length 0
17:38:05.777625 IP 5.6.7.8.80 > 1.1.2.3.58891: Flags [S.], seq 1819462245, ack 1722990084, win 5792, options [mss 1460,sackOK,TS val 895709 ecr 939024,nop,wscale 6], length 0
17:38:05.777658 IP 1.1.2.3.58891 > 5.6.7.8.80: Flags [.], ack 1819462246, win 92, options [nop,nop,TS val 939027 ecr 895709], length 0
17:38:05.777726 IP 1.1.2.3.58891 > 5.6.7.8.80: Flags [P.], seq 1722990084:1722990200, ack 1819462246, win 92, options [nop,nop,TS val 939027 ecr 895709], length 116
17:38:05.789253 IP 5.6.7.8.80 > 1.1.2.3.58891: Flags [.], ack 1722990200, win 91, options [nop,nop,TS val 895712 ecr 939027], length 0
17:38:05.791649 IP 5.6.7.8.80 > 1.1.2.3.58891: Flags [.], seq 1819462246:1819463694, ack 1722990200, win 91, options [nop,nop,TS val 895712 ecr 939027], length 1448
17:38:05.791661 IP 1.1.2.3.58891 > 5.6.7.8.80: Flags [.], ack 1819463694, win 137, options [nop,nop,TS val 939031 ecr 895712], length 0
17:38:05.791672 IP 5.6.7.8.80 > 1.1.2.3.58891: Flags [.], seq 1819463694:1819465142, ack 1722990200, win 91, options [nop,nop,TS val 895712 ecr 939027], length 1448
17:38:05.791687 IP 1.1.2.3.58891 > 5.6.7.8.80: Flags [.], ack 1819465142, win 182, options [nop,nop,TS val 939031 ecr 895712], length 0
17:38:05.791694 IP 5.6.7.8.80 > 1.1.2.3.58891: Flags [P.], seq 1819465142:1819466196, ack 1722990200, win 91, options [nop,nop,TS val 895712 ecr 939027], length 1054
17:38:05.791707 IP 1.1.2.3.58891 > 5.6.7.8.80: Flags [.], ack 1819466196, win 227, options [nop,nop,TS val 939031 ecr 895712], length 0
17:38:05.792223 IP 1.1.2.3.58891 > 5.6.7.8.80: Flags [F.], seq 1722990200, ack 1819466196, win 227, options [nop,nop,TS val 939031 ecr 895712], length 0
17:38:05.800434 IP 1.1.2.3.58892 > 5.6.7.8.80: Flags [S], seq 2192271662, win 5840, options [mss 1460,sackOK,TS val 939033 ecr 0,nop,wscale 6], length 0
17:38:05.803732 IP 5.6.7.8.80 > 1.1.2.3.58891: Flags [F.], seq 1819466196, ack 1722990201, win 91, options [nop,nop,TS val 895715 ecr 939031], length 0
17:38:05.803764 IP 1.1.2.3.58891 > 5.6.7.8.80: Flags [.], ack 1819466197, win 227, options [nop,nop,TS val 939034 ecr 895715], length 0
17:38:05.811866 IP 5.6.7.8.80 > 1.1.2.3.58892: Flags [S.], seq 4244419759, ack 2192271663, win 5792, options [mss 1460,sackOK,TS val 895717 ecr 939033,nop,wscale 6], length 0
17:38:05.811889 IP 1.1.2.3.58892 > 5.6.7.8.80: Flags [.], ack 4244419760, win 92, options [nop,nop,TS val 939036 ecr 895717], length 0
17:38:05.811951 IP 1.1.2.3.58892 > 5.6.7.8.80: Flags [P.], seq 2192271663:2192271779, ack 4244419760, win 92, options [nop,nop,TS val 939036 ecr 895717], length 116
17:38:05.823349 IP 5.6.7.8.80 > 1.1.2.3.58892: Flags [.], ack 2192271779, win 91, options [nop,nop,TS val 895720 ecr 939036], length 0
17:38:05.825745 IP 5.6.7.8.80 > 1.1.2.3.58892: Flags [.], seq 4244419760:4244421208, ack 2192271779, win 91, options [nop,nop,TS val 895721 ecr 939036], length 1448
17:38:05.825758 IP 1.1.2.3.58892 > 5.6.7.8.80: Flags [.], ack 4244421208, win 137, options [nop,nop,TS val 939039 ecr 895721], length 0
17:38:05.825765 IP 5.6.7.8.80 > 1.1.2.3.58892: Flags [.], seq 4244421208:4244422656, ack 2192271779, win 91, options [nop,nop,TS val 895721 ecr 939036], length 1448
17:38:05.825772 IP 1.1.2.3.58892 > 5.6.7.8.80: Flags [.], ack 4244422656, win 182, options [nop,nop,TS val 939039 ecr 895721], length 0
17:38:05.825776 IP 5.6.7.8.80 > 1.1.2.3.58892: Flags [.], seq 4244422656:4244424104, ack 2192271779, win 91, options [nop,nop,TS val 895721 ecr 939036], length 1448
17:38:05.825784 IP 1.1.2.3.58892 > 5.6.7.8.80: Flags [.], ack 4244424104, win 227, options [nop,nop,TS val 939039 ecr 895721], length 0
17:38:05.837226 IP 5.6.7.8.80 > 1.1.2.3.58892: Flags [P.], seq 4244424104:4244424365, ack 2192271779, win 91, options [nop,nop,TS val 895723 ecr 939039], length 261
17:38:05.837245 IP 1.1.2.3.58892 > 5.6.7.8.80: Flags [.], ack 4244424365, win 273, options [nop,nop,TS val 939042 ecr 895723], length 0
17:38:05.837683 IP 1.1.2.3.58892 > 5.6.7.8.80: Flags [F.], seq 2192271779, ack 4244424365, win 273, options [nop,nop,TS val 939042 ecr 895723], length 0
17:38:05.849056 IP 5.6.7.8.80 > 1.1.2.3.58892: Flags [F.], seq 4244424365, ack 2192271780, win 91, options [nop,nop,TS val 895726 ecr 939042], length 0
17:38:05.849085 IP 1.1.2.3.58892 > 5.6.7.8.80: Flags [.], ack 4244424366, win 273, options [nop,nop,TS val 939045 ecr 895726], length 0
17:38:05.909626 IP 1.1.2.3.58893 > 5.6.7.8.80: Flags [S], seq 4027880170, win 5840, options [mss 1460,sackOK,TS val 939060 ecr 0,nop,wscale 6], length 0
17:38:05.921040 IP 5.6.7.8.80 > 1.1.2.3.58893: Flags [S.], seq 1459154973, ack 4027880171, win 5792, options [mss 1460,sackOK,TS val 895745 ecr 939060,nop,wscale 6], length 0
17:38:05.921084 IP 1.1.2.3.58893 > 5.6.7.8.80: Flags [.], ack 1459154974, win 92, options [nop,nop,TS val 939063 ecr 895745], length 0
17:38:05.921153 IP 1.1.2.3.58893 > 5.6.7.8.80: Flags [P.], seq 4027880171:4027880287, ack 1459154974, win 92, options [nop,nop,TS val 939063 ecr 895745], length 116
17:38:05.932669 IP 5.6.7.8.80 > 1.1.2.3.58893: Flags [.], ack 4027880287, win 91, options [nop,nop,TS val 895747 ecr 939063], length 0
17:38:05.935315 IP 5.6.7.8.80 > 1.1.2.3.58893: Flags [.], seq 1459154974:1459156422, ack 4027880287, win 91, options [nop,nop,TS val 895748 ecr 939063], length 1448
17:38:05.935327 IP 1.1.2.3.58893 > 5.6.7.8.80: Flags [.], ack 1459156422, win 137, options [nop,nop,TS val 939067 ecr 895748], length 0
17:38:05.935334 IP 5.6.7.8.80 > 1.1.2.3.58893: Flags [.], seq 1459156422:1459157870, ack 4027880287, win 91, options [nop,nop,TS val 895748 ecr 939063], length 1448
17:38:05.935341 IP 1.1.2.3.58893 > 5.6.7.8.80: Flags [.], ack 1459157870, win 182, options [nop,nop,TS val 939067 ecr 895748], length 0
17:38:05.935346 IP 5.6.7.8.80 > 1.1.2.3.58893: Flags [.], seq 1459157870:1459159318, ack 4027880287, win 91, options [nop,nop,TS val 895748 ecr 939063], length 1448
17:38:05.935354 IP 1.1.2.3.58893 > 5.6.7.8.80: Flags [.], ack 1459159318, win 227, options [nop,nop,TS val 939067 ecr 895748], length 0
17:38:05.946948 IP 5.6.7.8.80 > 1.1.2.3.58893: Flags [.], seq 1459159318:1459160766, ack 4027880287, win 91, options [nop,nop,TS val 895751 ecr 939067], length 1448
17:38:05.946965 IP 1.1.2.3.58893 > 5.6.7.8.80: Flags [.], ack 1459160766, win 273, options [nop,nop,TS val 939070 ecr 895751], length 0
17:38:05.946971 IP 5.6.7.8.80 > 1.1.2.3.58893: Flags [P.], seq 1459160766:1459162214, ack 4027880287, win 91, options [nop,nop,TS val 895751 ecr 939067], length 1448
17:38:05.946978 IP 1.1.2.3.58893 > 5.6.7.8.80: Flags [.], ack 1459162214, win 318, options [nop,nop,TS val 939070 ecr 895751], length 0
17:38:05.947045 IP 5.6.7.8.80 > 1.1.2.3.58893: Flags [.], seq 1459162214:1459163662, ack 4027880287, win 91, options [nop,nop,TS val 895751 ecr 939067], length 1448
17:38:05.947053 IP 1.1.2.3.58893 > 5.6.7.8.80: Flags [.], ack 1459163662, win 363, options [nop,nop,TS val 939070 ecr 895751], length 0
17:38:05.947059 IP 5.6.7.8.80 > 1.1.2.3.58893: Flags [P.], seq 1459163662:1459163823, ack 4027880287, win 91, options [nop,nop,TS val 895751 ecr 939067], length 161
17:38:05.947065 IP 1.1.2.3.58893 > 5.6.7.8.80: Flags [.], ack 1459163823, win 408, options [nop,nop,TS val 939070 ecr 895751], length 0
17:38:05.947515 IP 1.1.2.3.58893 > 5.6.7.8.80: Flags [F.], seq 4027880287, ack 1459163823, win 408, options [nop,nop,TS val 939070 ecr 895751], length 0
17:38:05.958054 IP 1.1.2.3.58894 > 5.6.7.8.80: Flags [S], seq 620063999, win 5840, options [mss 1460,sackOK,TS val 939072 ecr 0,nop,wscale 6], length 0
17:38:05.959029 IP 5.6.7.8.80 > 1.1.2.3.58893: Flags [F.], seq 1459163823, ack 4027880288, win 91, options [nop,nop,TS val 895754 ecr 939070], length 0
17:38:05.959060 IP 1.1.2.3.58893 > 5.6.7.8.80: Flags [.], ack 1459163824, win 408, options [nop,nop,TS val 939073 ecr 895754], length 0
17:38:05.969510 IP 5.6.7.8.80 > 1.1.2.3.58894: Flags [S.], seq 1565998995, ack 620064000, win 5792, options [mss 1460,sackOK,TS val 895757 ecr 939072,nop,wscale 6], length 0
17:38:05.969536 IP 1.1.2.3.58894 > 5.6.7.8.80: Flags [.], ack 1565998996, win 92, options [nop,nop,TS val 939075 ecr 895757], length 0
17:38:05.969615 IP 1.1.2.3.58894 > 5.6.7.8.80: Flags [P.], seq 620064000:620064116, ack 1565998996, win 92, options [nop,nop,TS val 939075 ecr 895757], length 116
17:38:05.981141 IP 5.6.7.8.80 > 1.1.2.3.58894: Flags [.], ack 620064116, win 91, options [nop,nop,TS val 895760 ecr 939075], length 0
17:38:05.983786 IP 5.6.7.8.80 > 1.1.2.3.58894: Flags [.], seq 1565998996:1566000444, ack 620064116, win 91, options [nop,nop,TS val 895760 ecr 939075], length 1448
17:38:05.983797 IP 1.1.2.3.58894 > 5.6.7.8.80: Flags [.], ack 1566000444, win 137, options [nop,nop,TS val 939079 ecr 895760], length 0
17:38:05.983805 IP 5.6.7.8.80 > 1.1.2.3.58894: Flags [.], seq 1566000444:1566001892, ack 620064116, win 91, options [nop,nop,TS val 895760 ecr 939075], length 1448
